YEAR,CLASS,Scientific Name,Common Name,"Global
Rank","State
Rank","Federal
Status","State
Status","SWAP
Status",Counties of occurrence
2019,Freshwater Mussels,Pleurobema decisum,southern clubshell,G2,S2,LE,SP,P2,"Counties of occurrence: Bibb, Calhoun, Cherokee, Chilton, Choctaw, Clarke, Cleburne, Coosa, Dallas, Elmore, Etowah, Greene, Jefferson, Lamar, Lee, Macon, Marion, Monroe, Montgomery, Perry, Pickens, Shelby, St. Clair, Sumter, Talladega, Tuscaloosa, Walker, Washington, Wilcox, Winston "
2019,Freshwater Mussels,Pleurobema georgianum,southern pigtoe,G1,S1,LE,SP,P1,"Counties of occurrence:  Calhoun, Cherokee, Clay, Cleburne, Coosa, Etowah, Shelby, St. Clair, Talladega"
2019,Freshwater Mussels,Pleurobema hanleyianum,Georgia pigtoe,G1,SX,C,SP,P1,"Counties of occurrence4:  Cherokee, Clay, Etowah, St. Clair"
2019,Freshwater Mussels,Pleurobema hartmanianum,Cherokee pigtoe,G1,SX,,PSM,EX,"Counties of occurrence4:  Cherokee, Elmore, Etowah, Shelby, Talladega"
2019,Freshwater Mussels,Pleurobema oviforme,Tennessee clubshell,G2G3,S1,UR,PSM,P1,"Counties of occurrence:  Colbert4, Franklin4, Jackson, Lauderdale4, Limestone4, Madison, Marshall"
2019,Freshwater Mussels,Pleurobema perovatum,ovate clubshell,G1,S1,LE,SP,P1,"Counties of occurrence:  Autauga4, Bibb, Blount, Cherokee, Choctaw4, Clarke4, Cullman, Dallas4, Elmore4, Etowah, Fayette4, Greene, Jefferson4, Lamar, Lee, Macon, Marion4, Monroe4, Perry, Pickens, Shelby4, St. Clair, Sumter, Tuscaloosa, Walker, Wilcox4, Winston"
2019,Freshwater Mussels,Pleurobema plenum,rough pigtoe,G1,S1,LE,SP,P1,"Counties of occurrence:  Colbert, Jackson4, Lauderdale, Lawrence4, Limestone4, Madison, Marshall, Morgan"
2019,Freshwater Mussels,Pleurobema pyriforme,oval pigtoe,G2,S1,LE,SP,P1,"Counties of occurrence:  Houston, Lee4, Russell4"
2019,Freshwater Mussels,Pleurobema rubellum,warrior pigtoe7,G1G2,S1,LE46,SP,P1,"Counties of occurrence:  Cullman4, Fayette, Jefferson4. Lawrence, Shelby4, Tuscaloosa, Winston"
2019,Freshwater Mussels,Pleurobema rubrum,pyramid pigtoe,G2G3,S1,UR,SP,P1,"Counties of occurrence:  Colbert, Jackson4, Lauderdale, Limestone4, Madison, Marshall, Morgan"
2019,Freshwater Mussels,Pleurobema sintoxia,round pigtoe,G4G5,S1,,SP,P1,"Counties of occurrence:  Colbert, Jackson4, Lauderdale, Limestone, Madison, Marshall, Morgan"
2019,Freshwater Mussels,Pleurobema stabile,Coosa pigtoe,G1,SX,,PSM,P1,
2019,Freshwater Mussels,Pleurobema strodeanum,fuzzy pigtoe,G2,S2,LT,SP,P2,"Counties of occurrence:  Barbour, Bullock, Butler, Coffee, Conecuh, Covington, Crenshaw, Dale, Escambia, Geneva, Henry, Houston, Pike"
2019,Freshwater Mussels,Pleurobema taitianum,heavy pigtoe,G1,S1,LE,SP,P1,"Counties of occurrence:  Choctaw, Clarke4, Dallas, Elmore4, Greene4, Jefferson4, Marengo, Monroe4, Montgomery4, Pickens4, Sumter4, Walker4, Washington4,Wilcox4"
2019,Freshwater Snails,Pleurocera alveare,rugged hornsnail,G3,S1,,,P2,"Counties of occurrence:  Colbert, Lauderdale, Lawrence, Limestone4"
2019,Freshwater Snails,Pleurocera annulifera,ringed hornsnail7,G3G4,S3S4,,,,
2019,Freshwater Snails,Pleurocera brumbyi,spiral hornsnail7,G2G3,S2S3,,,,
2019,Freshwater Snails,Pleurocera corpulenta,corpulent hornsnail,G1,S1,UR,,P1,Counties of occurrence:  Jackson
2019,Freshwater Snails,Pleurocera curta,shortspire hornsnail,G2,S1S2,,,,
2019,Freshwater Snails,Pleurocera foremani,rough hornsnail7,G1,S1,C,SP,P1,"Counties of occurrence:  Elmore, Shelby"
2019,Freshwater Snails,Pleurocera nobilis,noble hornsnail,G2,S2,,,,Counties of occurrence:  Jackson
2019,Freshwater Snails,Pleurocera postelli,broken hornsnail7,G2Q,S2,,,,
2019,Freshwater Snails,Pleurocera prasinata,smooth hornsnail7,G4,S4,,,,"Counties of occurrence:  Choctaw, Dallas, Shelby, Sumter, Washington, Wilcox"
2019,Freshwater Snails,Pleurocera pyrenella,skirted hornsnail7,G2,S2,UR,,P2,"Counties of occurrence:  Limestone, Madison, Morgan4"
2019,Freshwater Snails,Pleurocera showalteri,upland hornsnail,G2Q,S2,,,,"Counties of occurrence:  Shelby, St. Clair, Talladega"
2019,Freshwater Snails,Pleurocera trochiformis,sulcate hornsnail,G2,S2,,,,
2019,Freshwater Snails,Pleurocera vestita,brook hornsnail,G3,S2,,,,Counties of occurrence:  Shelby
2019,Freshwater Snails,Pleurocera walkeri,telescope hornsnail,G3,S3,,,,Counties of occurrence:  Lauderdale
2019,Freshwater Mussels,Pleuronaia barnesiana,Tennessee pigtoe,G2G3,S1,UR,PSM,P2,"Counties of occurrence:  Colbert4, Franklin4, Jackson, Lauderdale4, Limestone, Madison, Marshall"
2019,Freshwater Mussels,Pleuronaia dolabelloides,slabside pearlymussel,G2,S1,LE,SP,P1,"Counties of occurrence:  Colbert, Franklin4, Jackson, Lauderdale4, Limestone4, Madison, Marshall, Morgan4"
2019,Fishes,Poecilia latipinna,sailfin molly,G5,S2,,,,"Counties of occurrence:  Baldwin, Mobile"
2019,Dicots,Polanisia tenuifolia,slenderleaf clammy-weed,G5,S1,,,,Counties of occurrence:  Baldwin
2019,Dicots,Polygala balduinii ,white milkwort,G4,S1?,,,,
2019,Dicots,Polygala crenata ,crenate milkwort,G4?,S1,,,,"Counties of occurrence:  Baldwin, Mobile"
2019,Dicots,Polygala hookeri ,Hooker's milkwort,G3,S1S2,,,,"Counties of occurrence:  Baldwin, Covington, Escambia, Geneva"
2019,Dicots,Polygala senega var. latifolia ,Seneca snakeroot,G4G5T?,S1,,,,"Counties of occurrence:  Franklin, Jackson"
2019,Dicots,Polygonella americana ,southern jointweed,G5,S1,,,,"Counties of occurrence:  Blount, Cherokee, Cullman, DeKalb, Lamar"
2019,Dicots,Polygonella macrophylla ,large-leaved jointweed,G3,S1,,,,Counties of occurrence:  Baldwin
2019,Terrestrial Snails,Polygyra cereolus,southern flatcoil,G4,SNR,,,,
2019,Terrestrial Snails,Polygyra septemvolva,Florida flatcoil,G5,SNR,,,,
2019,Dicots,Polymnia laevigata,Tennessee leafcup,G3,S2S3,,,,"Counties of occurrence:  Bibb, Jackson, Madison, Tuscaloosa"
2019,Fishes,Polyodon spathula,paddlefish,G4,S3,,"CNGF, SP31",,"Counties of occurrence:  Autauga, Baldwin, Choctaw, Clarke, Dallas, Elmore, Greene, Hale, Lauderdale, Limestone, Lowndes, Macon, Marengo, Mobile, Monroe, Montgomery, Perry, Sumter, Tallapoosa, Tuscaloosa, Walker, Washington, Wilcox"
2019,Birds,Porphyrio martinicus,Purple Gallinule,G5,S2B,,GB,,"Counties of occurrence:  Baldwin, Barbour, Choctaw, Clarke, Coffee, Covington, Crenshaw, Dale, Escambia, Geneva, Henry, Houston, Mobile, Washington"
2019,Freshwater Mussels,Potamilus inflatus,inflated Heelsplitter,G1G2Q,S1S2,LT,SP,P2,"Counties of occurrence:  Baldwin, Choctaw, Clarke, Dallas4, Greene, Hale, Marengo, Monroe4, Perry4, Pickens, Sumter, Tuscaloosa, Washington"
2019,Freshwater Mussels,Potamilus ohiensis,pink papershell,G5,S3,,PSM,,"Counties of occurrence:  Colbert, Jackson, Lauderdale, Limestone, Morgan"
2019,Terrestrial Snails,Praticolella lawae,Appalachian shrubsnail,G3,SNR,,,,
2019,Terrestrial Snails,Praticolella mobiliana,Choctaw shrubsnail,G3,SNR,,,,
2019,Dicots,Prenanthes barbata,barbed rattlesnake-root,G3,S1S2,,,,"Counties of occurrence:  Cherokee, Clarke, Dallas, Etowah, Madison"
2019,Insects,Problema byssus,byssus skipper,G3G4,S2S3,,,,
2019,Crayfish and Shrimp,Procambarus bivittatus,ribbon crayfish,G5,S3S4,,,,"Counties of occurrence4:  Baldwin, Bullock, Clarke, Mobile, Monroe, Pike, Washington"
2019,Crayfish and Shrimp,Procambarus capillatus,capillaceous crayfish,G3,S2,,,P2,"Counties of occurrence:  Conecuh4, Escambia, Monroe4"
2019,Crayfish and Shrimp,Procambarus clemmeri,cockscomb crayfish,G5,S2,,,P2,"Counties of occurrence:  Mobile, Washington4"
2019,Crayfish and Shrimp,Procambarus escambiensis,Escambia crayfish,G2,S2,,,P1,"Counties of occurrence4:  Baldwin, Escambia"
2019,Crayfish and Shrimp,Procambarus evermanni,panhandle crayfish,G4,S3,,,P2,"Counties of occurrence:  Baldwin, Mobile"
2019,Crayfish and Shrimp,"Procambarus hagenianus
hagenianus","southeastern prairie
crayfish",G4G5T4,S1,,,P2,Counties of occurrence:  Sumter
2019,Crayfish and Shrimp,Procambarus hayi,straightedge crayfish,G5,S1,,,P2,Counties of occurrence:
2019,Crayfish and Shrimp,Procambarus hubbelli,jackknife crayfish,G4,S2,,,P2,Counties of occurrence:  Covington
2019,Crayfish and Shrimp,Procambarus hybus,smoothnose crayfish,G5,S3,,,P2,
2019,Crayfish and Shrimp,Procambarus lagniappe,lagniappe crayfish,G2,S1,,,P2,"Counties of occurrence:  Baldwin, Pickens, Sumter, Washington"
2019,Crayfish and Shrimp,Procambarus leconteii,Mobile crayfish,G3G4,S3,,,P2,"Counties of occurrence:  Mobile, Washington"
2019,Crayfish and Shrimp,Procambarus lewisi,spur crayfish7,G4,S3,,,P2,"Counties of occurrence4:  Barbour, Bullock, Butler, Lowndes, Macon, Montgomery, Russell"
2019,Crayfish and Shrimp,Procambarus marthae,crisscross crayfish,G3,S2,,,P2,"Counties of occurrence:  Dallas, Hale, Monroe, Perry"
2019,Crayfish and Shrimp,Procambarus okaloosae,Okaloosa crayfish,G4,S2,,,P2,"Counties of occurrence:  Butler4, Covington, Escambia4"
2019,Crayfish and Shrimp,Procambarus paeninsulanaus,Peninsula crayfish,G5,S2,,,P2,"Counties of occurrence:  Houston4, Lee"
2019,Crayfish and Shrimp,Procambarus penni,pearl blackwater crayfish,G3,S2,,,,"Counties of occurrence4:  Mobile, Washington"
2019,Crayfish and Shrimp,Procambarus planirostris,flatnose crayfish,G4,SNR,,,P2,
2019,Crayfish and Shrimp,Procambarus shermani,Gulf crayfish,G4,S2,,,,"Counties of occurrence:  Baldwin4, Mobile, Washington"
2019,Crayfish and Shrimp,Procambarus suttlusi,Choctawhatchee crayfish,G3G4,S3,,,,"Counties of occurrence:  Bullock, Coffee, Dale, Geneva, Henry, Pike"
2019,Crayfish and Shrimp,Procambarus viaeviridis,vernal crayfish,G5,S1,,,P1,"Counties of occurrence4:  Lauderdale, Tuscaloosa"
2019,Crayfish and Shrimp,Procambarus vioscai paynei,Payne’s Creek crayfish,G5T4,S3,,,,"Counties of occurrence:  Choctaw, Clarke, Greene4, Marengo, Tuscaloosa4"
2019,Insects,Progomphus bellei,Belle's sanddragon,G3,SH,,,,
2019,Monocots,Prosartes maculata,spotted mandarin,G3G4,S1,,,,Counties of occurrence:  Jackson
2019,Amphibians,Pseudacris ocularis,Little Grass Frog,G5,S1,,,P2,Counties of occurrence:  Houston
2019,Insects,Pseudanophthalmus alabamae,a ground beetle,G2,S2,,,,Counties of occurrence:  DeKalb
2019,Insects,Pseudanophthalmus alladini,a cave obligate beetle,G3G4,S2,,,,"Counties of occurrence:  Jackson, Madison"
2019,Insects,Pseudanophthalmus assimilis,West Wills Valley cave beetle,G1G2,S1,,,,Counties of occurrence:  DeKalb
2019,Insects,Pseudanophthalmus distinguens,a ground beetle,G1G2,S1,,,,Counties of occurrence:  Morgan
2019,Insects,Pseudanophthalmus fluviatilis,a cave obligate beetle,G3,S2,,,,"Counties of occurrence:  Marshall, Morgan"
2019,Insects,Pseudanophthalmus lodingi,a ground beetle,G1G2,S1S2,,,,Counties of occurrence:  Madison
2019,Insects,Pseudanophthalmus meridionalis,a cave obligate beetle,G2,S2,,,,Counties of occurrence:  Marshall
2019,Insects,Pseudanophthalmus nickajackensis,Nickajack Cave beetle,G1,S1,,,,Counties of occurrence:  Jackson
2019,Insects,Pseudanophthalmus profundus,a cave obligate beetle,G2,S2,,,,"Counties of occurrence:  Jackson, Madison"
2019,Insects,Pseudanophthalmus sequoyah,Sequoyah cave beetle7,G1,S1,,,,Counties of occurrence:  DeKalb
2019,Insects,Pseudanophthalmus steevesi,a cave obligate beetle7,G1G2,S1S2,,,,Counties of occurrence:  Blount
2019,Reptiles,Pseudemys alabamensis,Alabama Red-bellied Cooter,G1,S1,LE,SP,P1,"Counties of occurrence:  Baldwin, Mobile, Monroe3"
2019,"Diplurans, Springtails and Proturans",Pseudosinella argentea,a springtail,GNR,S1,,,,Counties of occurrence:  Jefferson
2019,"Diplurans, Springtails and Proturans",Pseudosinella christianseni,a cave obligate springtail,G5,S2,,,,"Counties of occurrence:  DeKalb, Jackson, Morgan"
2019,"Diplurans, Springtails and Proturans",Pseudosinella collina,a springtail,GNR,S1,,,,"Counties of occurrence:  Blount, Calhoun, Jackson, Jefferson"
2019,"Diplurans, Springtails and Proturans",Pseudosinella folsomi,a springtail,GNR,S1,,,,Counties of occurrence:  Blount
2019,"Diplurans, Springtails and Proturans",Pseudosinella nata,a cave obligate springtail7,G1,S1,,,,Counties of occurrence:  Jefferson
2019,"Diplurans, Springtails and Proturans",Pseudosinella pecki,a cave obligate springtail,G2G3,S1,,,,Counties of occurrence:  Jackson
2019,"Diplurans, Springtails and Proturans",Pseudosinella violenta,a springtail,GNR,S1,,,,Counties of occurrence:  Blount
2019,Millipedes,Pseudotremia eburnea,a cave obligate millipede,G2G4,SNR,,,,"Counties of occurrence:  Jackson, Marshall"
2019,Millipedes,Pseudotremia minos,a cave obligate millipede,G1,S1,,,,Counties of occurrence:  Jackson
2019,Millipedes,Pseudotremia nyx,a cave obligate millipede7,G1,S1,,,,Counties of occurrence:  Marshall
2019,Millipedes,Pseudotremia rhadamanthus,a cave obligate millipede,G1G2,SNR,,,,
2019,Freshwater Snails,Pseudotryonia grahamae,Salt Spring hydrobe7,G1,S1,,,P1,Counties of occurrence: Clarke 
2019,Ferns and Relatives,Psilotum nudum,whiskfern,G5,S1,,,,Counties of occurrence:  Lee
2019,Dicots,Pterocaulon virgatum,barbed rattlesnake-root,G5,S1,,,,Counties of occurrence:  Escambia
2019,Fishes,Pteronotropis euryzonus,broadstripe shiner,G3,S2,,,P1,"Counties of occurrence:  Barbour, Henry, Houston, Lee, Russell"
2019,Fishes,Pteronotropis grandipinnis,Apalachee shiner,GNR,S2,,,,Counties of occurrence:  Houston
2019,Fishes,Pteronotropis merlini,orangetail shiner,GNR,S3,,,,"Counties of occurrence:  Barbour, Bullock, Coffee, Dale, Geneva, Henry, Houston, Pike"
2019,Fishes,Pteronotropis signipinnis,flagfin shiner,G5,S3,,,,"Counties of occurrence:  Baldwin, Barbour, Choctaw, Clarke, Coffee, Conecuh, Covington, Dale, Escambia, Mobile, Monroe, Washington"
2019,Fishes,Pteronotropis welaka,bluenose shiner,G3G4,S2,,,P2,"Counties of occurrence:  Bibb, Clarke, Conecuh, Covington, Dallas, Geneva, Henry, Houston, Pickens, Tuscaloosa, Washington"
2019,Dicots,Ptilimnium costatum,eastern bishop-weed,G4,S1,,,,"Counties of occurrence:  Mobile, St. Clair"
2019,Insects,Ptomaphagus cavernicola,a cave carrion beetle,G4,S1,,,,Counties of occurrence:  Morgan
2019,Insects,Ptomaphagus chromolithus,a cave obligate beetle,G2G3,S2,,,,Counties of occurrence:  Jackson
2019,Insects,Ptomaphagus episcopus,a cave obligate beetle7,G1G2,S1S2,,,,Counties of occurrence:  Marshall
2019,Insects,Ptomaphagus hatchi,a cave obligate beetle,G3,S3,,,,"Counties of occurrence:  Jackson, Madison"
2019,Insects,Ptomaphagus hazelae,a cave obligate beetle7,G1G2,S1S2,,,,Counties of occurrence:  Jackson
2019,Insects,Ptomaphagus julius,a cave obligate beetle7,G1G2,S1S2,,,,Counties of occurrence:  Jackson
2019,Insects,Ptomaphagus laticornis,a cave obligate beetle7,G1G2,S1,,,,"Counties of occurrence:  Jackson, Madison"
2019,Insects,Ptomaphagus lodingi,a cave obligate beetle7,G1G2,S1S2,,,,Counties of occurrence:  Madison
2019,Insects,Ptomaphagus longicornis,a cave obligate beetle7,G3G4,S2,,,,"Counties of occurrence:  Jackson, Madison"
2019,Insects,Ptomaphagus solanum,a cave obligate beetle7,G1,S1,,,,Counties of occurrence:  Jackson
2019,Insects,Ptomaphagus torodei,a cave obligate beetle7,G1G2,S1S2,,,,Counties of occurrence:  Jackson
2019,Insects,Ptomaphagus valentinei,a cave obligate beetle7,G3G4,S2,,,,"Counties of occurrence:  Jackson, Marshall"
2019,Insects,Ptomaphagus walteri,a cave obligate beetle7,G1G2,S1S2,,,,Counties of occurrence:  Blount
2019,Insects,Ptomaphagus whiteselli,a cave obligate beetle,G2G3,S1,,,,Counties of occurrence:  DeKalb
2019,Freshwater Mussels,Ptychobranchus fasciolaris,kidneyshell,G4G5,S2,,PSM,P1,"Counties of occurrence: Colbert, Franklin, Jackson, Lauderdale, Limestone, Madison, Marshall, Morgan "
2019,Freshwater Mussels,Ptychobranchus foremanianus,rayed kidneyshell,G1,S1,LE47,SP,,"Counties of occurrence: Bibb, Calhoun, Cherokee, Chilton4, Cleburne, Coosa4, Elmore4, Etowah, Jefferson, Monroe4, Shelby, St. Clair, Talladega "
2019,Freshwater Mussels,Ptychobranchus greenii,triangular kidneyshell7,G1,S1,LE,SP,P1,"Counties of occurrence:  Blount, Cullman, Jefferson, Lawrence, Pickens4, Tuscaloosa, Walker, Winston"
2019,Freshwater Mussels,Ptychobranchus jonesi,southern kidneyshell,G1,S1,LE,SP,P1,"Counties of occurrence:  Barbour, Coffee, Conecuh4, Covington4, Dale, Escambia, Geneva, Henry4, Pike"
2019,Freshwater Mussels,Ptychobranchus subtentus,fluted kidneyshell,G2G3,SX,LE,SP,EX,"Counties of occurrence4:  Colbert, Jackson, Lauderdale, Limestone, Madison"
2019,Mammals,Puma concolor,cougar,G5,SX,LE12,GANOS,EX,
2019,Terrestrial Snails,Punctum blandianum,brown spot,G4,SNR,,,,
2019,Terrestrial Snails,Punctum smithi,lamellate spot,G4,SNR,,,,
2019,Terrestrial Snails,Punctum vitreum,glass spot,G5,SNR,,,,
2019,Terrestrial Snails,Pupisoma dioscoricola,yam babybody,G3,SNR,,,,
2019,Dicots,Pycnanthemum curvipes,a mountain-mint,G3,S1?,,,,"Counties of occurrence:  Calhoun, Chambers, Lee, Randolph"
2019,Dicots,Pycnanthemum nudum,Coastal Plain mountain mint,G5,S1,,,,"Counties of occurrence:  Covington, Geneva"
2019,Dicots,Pycnanthemum virginianum,Virginia mountain mint,G5,S1,,,,Counties of occurrence:  Cherokee
2019,Freshwater Mussels,Pyganodon cataract,eastern floater,G5,S1,,PSM,,"Counties of occurrence:  Barbour4, Russell, Tallapoosa"
2019,Insects,Pyreferra ceromatica,anointed sallow moth,GU,SU,,,,
2019,Dicots,Pyrularia pubera,buffalo-nut,G5,S2,,,,"Counties of occurrence:  Cherokee, Cleburne, DeKalb, Tallapoosa"
2019,Freshwater Mussels,Quadrula cylindrica cylindrica,rabbitsfoot,G3G4T3,S1,LT,SP,P1,"Counties of occurrence:  Colbert, Franklin4, Jackson, Lauderdale4, Limestone4, Madison, Marshall, Morgan4"
2019,Freshwater Mussels,Quadrula infucata,sculptured pigtoe,G3,S1,,PSM,P2,"Counties of occurrence:  Barbour4, Chambers4, Henry4, Houston, Lee, Russell"
2019,Freshwater Mussels,Quadrula intermedia,Cumberland monkeyface,G1,SX,LE-XN39,SP,EX,"Counties of occurrence4:  Colbert, Lauderdale, Limestone, Madison, Marshall"
2019,Freshwater Mussels,Quadrula kieneriana,Coosa orb,G3Q,SX,,PSM,EX,"Counties of occurrence4:  Chilton, Coosa, Elmore, Shelby, St. Clair, Talladega"
2019,Freshwater Mussels,Quadrula metanevra,monkeyface,G4,S3,,PSM,P2,"Counties of occurrence:  Autauga, Bibb, Calhoun4, Cherokee4, Clarke, Colbert, Dallas, Greene, Jackson, Lauderdale, Lawrence4, Limestone, Lowndes, Madison, Marshall, Monroe, Montgomery, Morgan, Perry, Pickens, Shelby4, St. Clair4, Sumter, Talladega4, Washington, Wilcox"
2019,Freshwater Mussels,Quadrula nobilis,Gulf Mapleleaf,G4,S3,,PSM,,"Counties of occurrence:  Autauga, Clarke, Coosa, Dallas, Elmore, Greene, Jefferson, Lowndes, Macon, Monroe, Pickens, Sumter, Talladega, Tuscaloosa, Washington, Wilcox"
2019,Freshwater Mussels,Quadrula sparsa,Appalachian monkeyface,G1,SX,LE,SP,EX,
2019,Freshwater Mussels,Quadrula stapes,stirrupshell,GH41,SX,LE,SP,,"Counties of occurrence4:  Dallas, Green, Lowndes, Montgomery, Pickens, Sumter"
2019,Freshwater Mussels,Quadrula succissa,purple pigtoe,G3G4,S3,,PSM,,"Counties of occurrence:  Barbour, Bullock, Butler, Coffee, Conecuh, Covington, Crenshaw, Dale, Escambia,
Geneva, Henry, Houston, Pike"
2019,Insects,Quedius erythrogaster,a beetle,GNR,S3,,,,"Counties of occurrence:  Blount, Colbert, Jackson, Madison, Marshall"
2019,Insects,Quedius fulgidis,a beetle,GNR,S1,,,,Counties of occurrence:  Calhoun
2019,Dicots,Quercus arkansana,Arkansas oak,G3,S3,,,,"Counties of occurrence:  Autauga, Bibb, Chilton, Hale, Henry, Perry, Pike, Sumter"
2019,Dicots,Quercus boyntonii,Boynton's sand post oak,G1,S1,,,,"Counties of occurrence:  Blount, Etowah, St. Clair"
2019,Dicots,Quercus georgiana,Georgia oak,G3,S2,,,,"Counties of occurrence:  Chambers, Jefferson, St. Clair"
2019,Dicots,Quercus macrocarpa,bur oak,G5,S2,,,,"Counties of occurrence:  Montgomery, Pickens, Sumter"
2019,Dicots,Quercus minima,dwarf live oak,G5,S2,,,,"Counties of occurrence:  Baldwin, Geneva"
2019,Dicots,Quercus oglethorpensis,Oglethorpe's oak,G3,S1,,,,"Counties of occurrence:  Marengo, Sumter, Wilcox"
2019,Dicots,Quercus similis,bottomland-post oak,G4,S1,,,,Counties of occurrence:  Mobile
2019,Terrestrial Snails,Rabdotus mooreanus,prairie rabdotus,G5,SNR,,,,
2019,Birds,Rallus elegans,King Rail,G3G4,"S2S3B, S4N",SC,GB,P2,"Counties of occurrence:  Baldwin, Barbour, Bullock, Crenshaw, Cullman, Lamar, Lauderdale, Lowndes, Macon, Marshall, Mobile, Montgomery, Morgan, Perry, Tuscaloosa, Wilcox"
2019,Birds,Rallus longirostris,Clapper Rail,G5,S2,SC,GB,,"Counties of occurrence:  Baldwin, Mobile"
2019,Dicots,Ranunculus flabellaris,yellow water-crowfoot,G5,S1,,,,"Counties of occurrence:  Greene, Limestone, Madison, Sumter"
2019,Dicots,Ranunculus longirostris,eastern white water crowfoot,G5,S1,,,,Counties of occurrence:  Morgan
2019,Freshwater Mussels,Reginaia rotulata,round ebonyshell,G1,S1,LE,SP,P1,"Counties of occurrence:  Conecuh, Covington, Escambia"
2019,Reptiles,Rhadinaea flavilata,Pine Woods Littersnake,G4,S2,,,,"Counties of occurrence:  Baldwin, Clarke, Mobile, Russell, Washington"
2019,Insects,Rhadine caudata,a ground beetle,G3,S2,,,,"Counties of occurrence:  Blount, Colbert, DeKalb, Jackson, Jefferson, Limestone, Marshall,"
2019,Insects,Rhadine larvalis,a beetle,GNR,S1,,,,Counties of occurrence:  Conecuh
2019,Dicots,Rhamnus lanceolata,lance-leaved buckthorn,G5,S2,,,,"Counties of occurrence:  Butler, Dallas, Hale, Lowndes, Pickens, Sumter"
2019,Freshwater Snails,Rhapinema dacryon,teardrop snail,G5,S2,,,,
2019,Dicots,Rhexia aristosa,awned meadowbeauty,G3G4,S1,,,,"Counties of occurrence:  Barbour, Henry"
2019,Dicots,Rhexia parviflora,small-flowered meadowbeauty,G2,S1,UR,,,"Counties of occurrence:  Covington, Escambia, Geneva"
2019,Dicots,Rhexia salicifolia,panhandle meadowbeauty,G2,S1,UR,,,"Counties of occurrence:  Covington, Houston"
2019,Freshwater Snails,Rhodacmea cahawbensis,Cahaba ancylid,G1,S1,UR,,P1,"Counties of occurrence:  Bibb, Shelby"
2019,Freshwater Snails,Rhodacmea filosa,wicker ancylid7,G1,S1,,,P1,Counties of occurrence:  Talladega
2019,Freshwater Snails,Rhodacmea hinkleyi,knobby ancylid,G2G3,SX,,,EX,
2019,Dicots,Rhododendron austrinum,orange azalea,G3,S2S3,,,,"Counties of occurrence:  Baldwin, Butler, Coffee, Conecuh, Covington, Crenchaw, Dale, Escambia, Geneva, Mobile, Monroe"
2019,Dicots,Rhododendron colemanii,Red Hills azalea,G?,S1,,,,"Counties of occurrence:  Barbour, Butler, Clarke, Conecuh, Monroe, Pike, Russell"
2019,Dicots,Rhododendron cumberlandense,Cumberland azalea,G4?,S2,,,,"Counties of occurrence:  Calhoun, Clay, Jackson"
2019,Dicots,Rhododendron minus,Carolina rhododendron,G4,S2,,,,"Counties of occurrence:  Barbour, Coosa, Henry, Jackson, Monroe"
2019,Dicots,Rhododendron prunifolium,plumleaf azalea,G3,S2S3,,,,"Counties of occurrence:  Barbour, Henry, Lee, Russell"
2019,Monocots,Rhynchospora alba,white beakrush,G5,S1,,,,Counties of occurrence:  Escambia
2019,Monocots,Rhynchospora capillacea,horned beakrush,G4,S1,,,,Counties of occurrence:  Bibb
2019,Monocots,Rhynchospora crinipes,hairy-peduncled beakrush,G2,S1,UR,,,"Counties of occurrence:  Baldwin, Conecuh, Covington, Escambia, Mobile, Washington"
2019,Monocots,Rhynchospora fernaldii,Fernald's beak rush,G3G4,S1,,,,Counties of occurrence: Baldwin
2019,Monocots,Rhynchospora globularis var. saxicola,Stone Mountain beakrush,G3Q,S1,,,,"Counties of occurrence:  Lee, Tallapoosa"
2019,Monocots,Rhynchospora harperi,Harper’s beakrush,G4?,S1,,,,"Counties of occurrence: Baldwin, Cherokee"
2019,Monocots,Rhynchospora macra,southern white beak rush,G3,S1,,,,"Counties of occurrence:  Covington, Mobile"
2019,Monocots,Rhynchospora pleiantha,brown beakrush,G2G3,S1,,,,"Counties of occurrence:  Baldwin, Covington, Houston"
2019,Monocots,Rhynchospora stenophylla,Chapman beakrush,G4,S2,,,,"Counties of occurrence:  Baldwin, Covington, Escambia, Geneva, Mobile"
2019,Monocots,Rhynchospora thornei,Thorne's beakrush,G3,S1,UR,,,"Counties of occurrence:  Bibb, Cherokee, Geneva"
2019,Monocots,Rhynchospora tracyi,Tracy's beak rush,G4,S1,,,,"Counties of occurrence:  Baldwin, Houston, Mobile"
2019,Dicots,Ribes curvatum,granite gooseberry,G4,S2,,,,"Counties of occurrence:  DeKalb, Jackson, Marshall"
2019,Dicots,Ribes cynosbati,prickly gooseberry,G5,S1S2,,,,"Counties of occurrence:  Cherokee, DeKalb, Jackson, Madison, Marshall"
2019,Dicots,Rubus allegheniensis,Allegheny blackberry,G5,S1,,,,Counties of occurrence:  Madison
2019,Dicots,Rudbeckia auriculata,Wand blackroot,G2,S2,UR,,,"Counties of occurrence:  Barbour, Blount, Covington, Crenshaw, Geneva, Jefferson, Pike, Shelby, St. Clair"
2019,Dicots,Rudbeckia heliopsidis,sun-facing coneflower,G2,S2,UR,,,"Counties of occurrence:  Cherokee, DeKalb, Lee, Macon, Monroe"
2019,Dicots,Rudbeckia mollis,soft-hair coneflower,G3G5,S1,,,,"Counties of occurrence:  Henry, Houston"
2019,Dicots,Rudbeckia nitida,shiny coneflower,G3,S1,,,,Counties of occurrence: Conecuh
2019,Dicots,Rudbeckia triloba var. pinnatiloba,pinnate-lobed black-eyed Susan,G5T3,S2S3,,,,"Counties of occurrence:  Autauga, Bibb, Dallas, Lowndes, Tallapoosa, Wilcox"
2019,Dicots,Ruellia noctiflora,night-flowering wild-petunia,G2,S1,,,,"Counties of occurrence:  Baldwin, Covington, Escambia, Mobile"
2019,Insects,Rymosia triangularis,a fungus gnat,GNR,S1,,,,Counties of occurrence:  Madison
2019,Birds,Rynchops niger,Black Skimmer,G5,"S2B,S4N",,SP,,"Counties of occurrence:  Baldwin, Mobile"
2019,Dicots,Sabatia brevifolia,short-leaved pink,G3G4,S1,,,,Counties of occurrence:  Baldwin
2019,Dicots,Sabatia capitata,rose gentian,G2,S2,,,,"Counties of occurrence:  Calhoun, Chilton, Clay, Cleburne, DeKalb, St. Clair"
2019,Dicots,Sabatia grandiflora,large-flowered pink,G3G4,S1?,,,,
2019,Dicots,Sabatia quadrangula,four-angled pink,G4G5,SH,,,,Counties of occurrence:  Houston
2019,Dicots,Sageretia minutiflora,tiny-leaved buckthorn,G4,S1,,,,"Counties of occurrence: Baldwin, Mobile"
2019,Monocots,Sagittaria isoetiformis,slender arrow-head,G4?,S2,,,,"Counties of occurrence:  Covington, Henry, Houston"
2019,Monocots,Sagittaria secundifolia,Little River arrow-head,G1,S1,LT,,,"Counties of occurrence:  Cherokee, Coosa, DeKalb, Winston"
