YEAR,CLASS,Scientific Name,Common Name,"Global
Rank","State
Rank","Federal
Status","State
Status","SWAP
Status",Counties of occurrence
2019,Fishes,Acantharchus pomotis,mud sunfish,G4G5,S1,,,,Counties of occurrence:  Washington
2019,Fishes,Acipenser fulvescens,lake sturgeon,G3G4,S1,,SP,EXCAU,"Counties of occurrence:  Cherokee, Limestone4, Madison4, Morgan4, Shelby4, St. Clair4, Talladega4"
2019,Fishes,Acipenser oxyrinchus desotoi,Gulf sturgeon,G3T2,S1,LT,SP,P2,"Counties of occurrence:  Baldwin, Bibb4,  Chilton4, Choctaw, Clarke, Coffee, Covington, Dale, Escambia, Elmore4, Geneva, Houston, Macon4, Marengo4, Mobile, Monroe, Sumter4, Washington, Wilcox"
2019,Dicots,Aconitum uncinatum,blue monkshood,G4,S1,,,,
2019,Dicots,Actaea rubifolia,Appalachian bugbane,G3,S1,,,,Counties of occurrence:  Madison
2019,Freshwater Mussels,Actinonaias ligamentina,mucket,G5,S2,,PSM,P1,"Counties of occurrence:  Colbert4, Jackson4, Lauderdale, Limestone4, Morgan4"
2019,Freshwater Mussels,Actinonaias pectorosa,pheasantshell,G4,SX,,PSM,EX,"Counties of occurrence:  Colbert4, Jackson4, Lauderdale, Limestone4"
2019,Dicots,Agalinis aphylla,leafless false-foxglove,G3G4,S2,,,,"Counties of occurrence:  Baldwin, Mobile, Washington"
2019,Dicots,Agalinis auriculata,auriculate false-foxglove,G3,S1,,,,"Counties of occurrence:  Montgomery4, Morgan4, Pickens, Wilcox4"
2019,Dicots,Agalinis divaricata,pineland false-foxglove,G3?,S1,,,,"Counties of occurrence:  Covington, Geneva"
2019,Dicots,Agalinis filicaulis,thin-stemmed false-foxglove,G3G4,S2,,,,Counties of occurrence:  Mobile
2019,Dicots,Agalinis gattingeri,Gattinger's false-foxglove,G4,SH,,,,
2019,Dicots,Agalinis georgiana,Georgia false-foxglove,GNR,S1,,,,"Counties of occurrence:  Covington, Geneva"
2019,Dicots,Agalinis heterophylla,prairie false-foxglove,G4G5,S2,,,,"Counties of occurrence:  Bullock, Dallas, Elmore, Hale, Marengo, Montgomery, Perry, Sumter"
2019,Dicots,Agalinis linifolia,flax-leaf false-foxglove,G4?,S2,,,,"Counties of occurrence:  Baldwin, Covington, Houston, Mobile"
2019,Dicots,Agalinis oligophylla,ridge-stem false-foxglove,G4,S1,,,,"Counties of occurrence:  Dallas, Sumter"
2019,Dicots,Agastache nepetoides,yellow giant hyssop,G5,S1,,,,"Counties of occurrence:  Jackson, Lawrence, Madison, Marshall"
2019,Dicots,Agrimonia incisa,incised groovebur,G3,S2,,,,"Counties of occurrence:  Baldwin, Bullock, Covington, Geneva, Mobile, Pike, Washington"
2019,Arachnids,Alabamocreagris mortis,a cave obligate pseudoscorpion7,G1G2,S1S2,,,,Counties of occurrence:  Jackson
2019,Arachnids,Alabamocreagris pecki,a cave obligate pseudoscorpion7,G1G2,S1S2,,,,Counties of occurrence:  Marshall
2019,Freshwater Mussels,Alasmidonta marginata,elktoe,G4,S1,,PSM,P1,"Counties of occurrence:  Colbert4, Franklin4, Jackson, Lauderdale4, Madison4"
2019,Freshwater Mussels,Alasmidonta triangulata,southern elktoe,G1Q,S1,UR,PSM,P1,Counties of occurrence:  Russell
2019,Freshwater Mussels,Alasmidonta viridis,slippershell mussel,G4G5,S1,,SP,P1,"Counties of occurrence:  Jackson, Madison"
2019,Monocots,Allium speculae,Little River Canyon onion,G2,S2,,,,"Counties of occurrence:  Cherokee, DeKalb, Jackson, Marshall"
2019,Monocots,Allium tricoccum,wild leek,G5,S1,,,,"Counties of occurrence:  Jackson, Marshall"
2019,Insects,Allocapnia sano,Sano stonefly7,G1,S1,,,,Counties of occurrence:  Madison
2019,Fishes,Alosa alabamae,Alabama shad,G2G3,S2,SC32,SP,P1,"Counties of occurrence:  Baldwin4, Bibb4, Choctaw, Clarke4, Covington, Dale, Dallas, Elmore4, Escambia, Geneva, Greene, Hale, Houston, Marengo4, Mobile4, Monroe, Perry4, Shelby4, Sumter, Tuscaloosa, Wilcox"
2019,Freshwater Mussels,Amblema elliottii,Coosa fiveridge,G3,S3,,PSM,,"Counties of occurrence:  Calhoun, Cherokee, Coosa, Elmore, Etowah, Jefferson, Shelby, St. Clair, Talladega, Tuscaloosa, Walker"
2019,Insects,Amblyscirtes alternata,dusky roadside-skipper,G2G3,S2S3,,,,
2019,Amphibians,Ambystoma bishopi,Reticulated Flatwoods Salamander,G2,S1,LE,SP,P1,"Counties of occurrence17:  Baldwin, Covington, Houston, Mobile"
2019,Amphibians,Ambystoma texanum,Small-mouthed Salamander,G5,S3,,,P2,"Counties of occurrence:  Choctaw, Madison, Marion, Montgomery, Morgan, Perry, Sumter, Tuscaloosa, Washington, Wilcox"
2019,Amphibians,Ambystoma tigrinum,Eastern Tiger Salamander,G5,S3,,,P2,"Counties of occurrence:  Bibb, Bullock, Calhoun, Chilton, Cleburne, Colbert, Covington, Crenshaw, Cullman, Dale, Escambia, Geneva, Henry, Houston, Jefferson, Macon, Marshall, Mobile, Montgomery, Shelby, Talladega"
2019,Fishes,Ameiurus brunneus,snail bullhead,G4,S3,,CNGF,,"Counties of occurrence:  Barbour, Chambers, Houston, Lee, Randolph, Russell"
2019,Fishes,Ameiurus catus,white catfish,G5,S3,,CNGF,,"Counties of occurrence:  Barbour, Geneva, Henry, Houston, Lee, Russell"
2019,Fishes,Ameiurus serracanthus,spotted bullhead,G3,S2,,CNGF,,"Counties of occurrence:  Barbour, Chambers, Henry, Houston, Lee, Russell"
2019,Millipedes,Ameractis satis,a cave obligate millipede,G2G4,SNR,,,,"Counties of occurrence:  Jackson, Marshall"
2019,Fishes,Ammocrypta bifascia,Florida sand darter,G4,S3,,,,"Counties of occurrence:  Baldwin, Butler, Coffee, Conecuh, Covington, Crenshaw, Dale, Escambia, Geneva, Houston, Pike"
2019,Fishes,Ammocrypta vivax,scaly sand darter,G5,S1,,,P1,Counties of occurrence:  Mobile
2019,Birds,Ammodramus henslowii,Henslow's Sparrow,G4,S2N,,SP,P1,"Counties of occurrence:  Baldwin, Covington, Escambia, Mobile"
2019,Birds,Ammodramus leconteii,Le Conte's Sparrow,G4,S3N,,SP,,"Counties of occurrence:  Baldwin, Mobile"
2019,Birds,Ammodramus maritimus,Seaside Sparrow,G4,S2,,SP,P2,"Counties of occurrence:  Baldwin, Mobile"
2019,Birds,Ammodramus nelsoni,Nelson’s Sparrow,G5,S3N,,SP,P2,"Counties of occurrence:  Baldwin, Mobile"
2019,Dicots,Amorpha nitens,indigo bush,G3?,S1?,,,,Counties of occurrence: Elmore4
2019,Dicots,Ampelaster carolinianus,Carolina aster,G5,S1,,,,Counties of occurrence:  Mobile
2019,Monocots,Amphicarpum muehlenbergianum,blue maiden-cane,G4,S1,,,,"Counties of occurrence:  Covington, Houston"
2019,Insects,Amphinemura alabama,Alabama Forestfly,G3,S2,,,,"Counties of occurrence:  Lauderdale, Limestone"
2019,Insects,Amphinemura mockfordi,Tennessee forestfly,G2,S1,UR,,,Counties of occurrence:  Madison
2019,Amphibians,Amphiuma means,Two-toed Amphiuma,G5,S3,,,,"Counties of occurrence:  Baldwin, Covington, Henry, Houston, Macon, Mobile, Monroe, Montgomery, Pike,
Washington"
2019,Amphibians,Amphiuma pholeter,One-toed Amphiuma,G3,S1,,SP,P2,"Counties of occurrence:  Baldwin, Mobile"
2019,Amphibians,Amphiuma tridactylum,Three-toed Amphiuma,G5,S3,,,,"Counties of occurrence:  Dallas, Hale, Sumter, Tuscaloosa, Washington"
2019,Dicots,Amsonia rigida,stiff blue-star,G4,S1,,,,"Counties of occurrence:  Geneva, Houston"
2019,Arachnids,Anahita punctulata,southeastern wandering spider,G4,SNR,,,,"Counties of occurrence:  Colbert, Jackson, Madison, Marshall, Morgan"
2019,Birds,Anas fulvigula,Mottled Duck,G4,"S2N,S3B",,SP,P2,"Counties of occurrence:  Baldwin, Mobile"
2019,Birds,Anas rubripes,American Black Duck,G5,"S2B,S5N",,SP,P2,"Counties of occurrence:  Limestone, Marshall, Morgan"
2019,Monocots,Andropogon arctatus,pine-woods bluestem,G3,S1,,,,"Counties of occurrence:  Covington, Geneva"
2019,Monocots,Andropogon perangustatus,Elliott’s beardgrass,G5T4,S1,,,,"Counties of occurrence:  Baldwin, Mobile, Covington"
2019,Monocots,Andropogon virginicus var. glaucus,beardgrass,G4T4T5,S2,,,,"Counties of occurrence:  Covington, Houston, Mobile"
2019,Amphibians,Aneides aeneus,Green Salamander,G3G4,S3,UR,SP,P2,"Counties of occurrence: Cherokee, Colbert, DeKalb, Franklin, Jackson, Lauderdale, Lawrence, Madison, Marion, Marshall, St. Clair, Tuscaloosa4, Walker, Winston "
2019,Terrestrial Snails,Anguispira alabama,Alabama tigersnail,G2,S2?,,,,
2019,Terrestrial Snails,Anguispira alternata,flamed tigersnail,G5,S1S2,,,,
2019,Terrestrial Snails,Anguispira cumberlandiana,Cumberland tigersnail,G3,S1S2,,,,
2019,Terrestrial Snails,Anguispira jessica,mountain disc,G3G4,S1S2,,,,
2019,Terrestrial Snails,Anguispira mordax,Appalachian tigersnail,G4,SNR,,,,
2019,Insects,Anillinus valentinei,a cave obligate beetle,G3G4,S1,,,,"Counties of occurrence:  DeKalb, Jefferson"
2019,Freshwater Mussels,Anodonta hartfieldorum,cypress floater,G4,S1,,PSM,,"Counties of occurrence:  Baldwin, Covington, Escambia"
2019,Freshwater Mussels,Anodonta suborbiculata,flat floater,G5,S3,,PSM,,"Counties of occurrence:  Calhoun, Cherokee, Colbert, Covington, Dallas, Etowah, Lauderdale, Limestone, Madison, Monroe, Morgan, St. Clair, Talladega, Wilcox"
2019,Freshwater Snails,Antrorbis breweri,Manitou snail7,G1,S1,UR,,P1,Counties of occurrence:  DeKalb
2019,Reptiles,Apalone ferox,Florida Softshell,G5,S2,,RT,,"Counties of occurrence: Baldwin, Covington, Escambia, Geneva, Mobile "
2019,Arachnids,Aphrastochthonius pecki,a cave obligate pseudoscorpion7,G1,S1,,,,Counties of occurrence:  Jefferson
2019,Arachnids,Aphrastochthonius tenax,a cave obligate pseudoscorpion,G1G2,S1S2,,,,Counties of occurrence:  Blount
2019,Dicots,Apios priceana,Price's potato-bean,G2,S2,LT,,,"Counties of occurrence:  Autauga, Dallas, Jackson, Lawrence, Madison, Marshall, Monroe, Wilcox"
2019,Monocots,Aplectrum hyemale,puttyroot,G5,S2,,,,"Counties of occurrence:  Conecuh, Etowah, Lawrence"
2019,Arachnids,Apochthonius russelli,a cave obligate pseudoscorpion,G1,S1,,,,Counties of occurrence:  Jackson
2019,Arachnids,Appaleptoneta barrowsi,a cave spider7,G1,S1,,,,Counties of occurrence:  Blount
2019,Arachnids,Appaleptoneta credulai,a cave spider7,G1,S1,,,,Counties of occurrence:  Lauderdale
2019,Arachnids,Appaleptoneta jonesi,a cave spider7,G1,S1,,,,Counties of occurrence:  Jefferson
2019,Dicots,Arabis georgiana,Georgia rockcress,G1,S1,LT,,,"Counties of occurrence:  Bibb, Dallas, Elmore, Monroe, Russell, Sumter, Wilcox"
2019,Dicots,Arabis patens,spreading rockcress,G3,S1,,,,"Counties of occurrence:  Marengo, Pickens"
2019,Dicots,Aralia racemosa,American spikenard,G4G5,S1,,,,"Counties of occurrence:  Etowah, Jackson"
2019,Non-Vascular Plants,Archidium tenerrimum,large-spored moss,G5?,S1?,,,,
2019,Freshwater Mussels,Arcidens confragosus,rock pocketbook,G4,S3,,PSM,,"Counties of occurrence:  Baldwin, Choctaw, Colbert, Dallas, Elmore, Greene, Hale, Lauderdale, Pickens, Sumter, Tuscaloosa, Wilcox"
2019,Insects,Argia plana,springwater dancer,G5,S1,,,,Counties of occurrence:  Jefferson
2019,Insects,Arianops ashei,a beetle7,GNR,S1,,,,Counties of occurrence: Butler 
2019,Insects,Arianops barri,a beetle7,GNR,S1,,,,Counties of occurrence: Jackson 
2019,Insects,Arianops cavernensis,a cave obligate beetle7,GNR,S1,,,,Counties of occurrence:   Marshall
2019,Insects,Arianops clintoni,a beetle7,GNR,S1,,,,Counties of occurrence:   Monroe
2019,Insects,Arianops extera,a beetle7,GNR,S1,,,,Counties of occurrence:   Jackson
2019,Insects,Arianops folkertsi,a beetle7,GNR,S1,,,,Counties of occurrence:   Walker
2019,Insects,Arianops kingi,a beetle7,GNR,S1,,,,Counties of occurrence:   St. Clair
2019,Insects,Arianops steevesi,a cave obligate beetle7,GNR,S1,,,,Counties of occurrence:   Jackson
2019,Monocots,Aristida mohrii,Mohr’s three-awn grass,G1,S1,,,,"Counties of occurrence:  Baldwin, Covington, Geneva, Mobile"
2019,Monocots,Aristida simpliciflora,southern three-awned grass,G3G4,S1,,,,"Counties of occurrence:  Baldwin, Covington, Dale, Escambia"
2019,Monocots,Aristida spiciformis,pine barren three-awned grass,G4,S1,,,,Counties of occurrence:  Baldwin
2019,Dicots,Armoracia lacustris,lake cress,G4?,S1,,,,"Counties of occurrence:  Colbert, Greene, Lawrence, Limestone"
2019,Dicots,Arnica acaulis,Leopardsbane,G4,SH,,,,Counties of occurrence:  Houston
2019,Dicots,Arnoglossum diversifolium,variable-leaved Indian-plantain,G2,S1,UR,,,Counties of occurrence:  Houston
2019,Dicots,Arnoglossum sulcatum,Indian-plantain,G3,S3,,,,"Counties of occurrence:  Baldwin, Conecuh, Covington, Dale, Escambia, Geneva, Monroe, Pike"
2019,"Diplurans, Springtails and Proturans",Arrhopalites pygmaeus,a springtail,GNR,S2,,,,"Counties of occurrence:  Blount, Jackson, Madison, Marshall"
2019,"Diplurans, Springtails and Proturans",Arrhopalites whitesidei,a springtail,GNR,S1,,,,Counties of occurrence:  Talladega
2019,Dicots,Asclepias cinerea,Carolina milkweed,G4?,S1,,,,"Counties of occurrence:  Covington, Geneva"
2019,Dicots,Asclepias exaltata,poke milkweed,G5,S1,,,,"Counties of occurrence:  Etowah, Jackson, Winston"
2019,Dicots,Asclepias rubra,red milkweed,G4G5,S1,,,,"Counties of occurrence:  Autauga. Covington, Escambia"
2019,Dicots,Asclepias tomentosa,velvet milkweed,G4,SH,,,,"Counties of occurrence:  Covington, Geneva"
2019,Dicots,Asclepias viridula,southern milkweed,G2,S1,,,,Counties of occurrence:  Houston
2019,Birds,Asio flammeus,Short-Eared Owl,G5,S2N,,SP,P2,"Counties of occurrence:  Autauga, Baldwin, Bibb, Dallas, Etowah, Henry, Jefferson, Lauderdale, Limestone, Marshall, Mobile, Montgomery"
2019,Ferns and Relatives,Asplenium abscissum,cutleaf spleenwort,G3G4,S1,,,,Counties of occurrence:  Jackson
2019,Ferns and Relatives,Asplenium bradleyi,Bradley's spleenwort,G4,S2,,,,"Counties of occurrence:  Etowah, Jackson, Talladega"
2019,Ferns and Relatives,Asplenium monanthes,single-sorus spleenwort,G4,S1,,,,
2019,Ferns and Relatives,Asplenium ruta-muraria,wall rue spleenwort,G5,S1,,,,"Counties of occurrence:  Bibb, Etowah, Jackson"
2019,Ferns and Relatives,Asplenium scolopendrium var. americanum,American Hart’s-tongue fern,G4T3,S1,LT,,,"Counties of occurrence:  Jackson, Morgan"
2019,Ferns and Relatives,Asplenium trichomanes,maidenhair spleenwort,G5,S2S3,,,,"Counties of occurrence:  Etowah, Jackson, Talladega, Tuscaloosa"
2019,Ferns and Relatives,Asplenium tutwilerae,Scott's spleenwort7,G1,S1,,,,Counties of occurrence:  Hale
2019,Dicots,Astragalus canadensis,Canadian milkvetch,G5,S1,,,,"Counties of occurrence:  Dallas, Madison, Sumter"
2019,Dicots,Astragalus obcordatus,Florida milkvetch,G3G4,S1,,,,Counties of occurrence:  Dallas
2019,Dicots,Astragalus tennesseensis,Tennessee milkvetch,G3,S1S2,,,,"Counties of occurrence:  Lawrence, Morgan"
2019,Dicots,Astragalus villosus,hoary milkvetch,G4,S2,,,,"Counties of occurrence: Baldwin4, Butler, Coffee, Conecuh, Dale, Escambia4, Mobile4, Pike, Russell4"
2019,Ferns and Relatives,Astrolepis x integerrima,hybrid cloak fern,HYB,S1,,,,Counties of occurrence:  Bibb
2019,Freshwater Snails,Athearnia anthonyi,Anthony riversnail,G1,S1,LE-XN48,SP,P1,"Counties of occurrence: Colbert, Jackson, Lauderdale, Limestone "
2019,Birds,Athene cunicularia,Burrowing Owl,G4,S2N,,SP,,Counties of occurrence:  Mobile
2019,Insects,Atheta alabama,a beetle,GNR,S1,,,,Counties of occurrence:   Morgan
2019,Insects,Atheta lucifuga,light shunning rove beetle,G4,S2,,,,"Counties of occurrence:   Blount, Jackson, Madison, Marshall"
2019,Fishes,Atractosteus spatula,alligator gar,G3G4,S2,,CNGF,,"Counties of occurrence:  Baldwin, Clarke, Escambia, Mobile, Monroe"
2019,Insects,Atrytone arogos arogos,arogos skipper,G3T1T2,SH,,,,
2019,Dicots,Aureolaria patula,spreading false-foxglove,G3,S1,,,,Counties of occurrence:  Cherokee
2019,Insects,Autochton cellus,golden-banded skipper,G4,S2,,,,
2019,Amphipods,Bactrurus wilsoni,an amphipod,G1G2,S1,,,,
2019,Insects,Baetisca becki,a mayfly,G2G3,S1,,,,
2019,Dicots,Balduina atropurpurea,purple balduina,G2,SH,UR,,,Counties of occurrence:  Geneva4
2019,Dicots,Baptisia australis var. aberrans,blue wild indigo,G5T2,S1,,,,Counties of occurrence:  Bibb
2019,Dicots,Baptisia megacarpa,Apalachicola wild indigo,G2,S2,UR,,,"Counties of occurrence:  Autauga, Bibb, Bullock, Crenshaw, Elmore, Henry, Lee, Lowndes, Macon, Montgomery, Pike, Tallapoosa"
2019,Crayfish and Shrimp,Barbicambarus simmonsi,Tennessee bottlebrush crayfish,G1G2,SNR,,,P1,
2019,Insects,Batriasymmodes spelaeus,a cave obligate beetle,G3G4,S3,,,,"Counties of occurrence:  Blount, DeKalb, Jackson, Lauderdale, Lawrence, Marshall, Morgan, St. Clair,, Walker,
Winston"
2019,Insects,Batriasymmodes troglodytes,a beetle7,G1G2,S1,,,,Counties of occurrence:   Butler
2019,Insects,Batrisodes cavernosus,a cave obligate beetle7,G1,S1,,,,"Counties of occurrence:  Butler, Clarke"
2019,Insects,Batrisodes jocuvestus,a cave obligate beetle7,G1,S1,,,,Counties of occurrence:  Madison
2019,Insects,Batrisodes jonesi,a cave obligate beetle7,G2G3,S2S3,,,,Counties of occurrence:  Colbert
2019,Insects,Batrisodes lineaticollis,a beetle,GNR,S1,,,,"Counties of occurrence:  Calhoun, Conecuh"
2019,Insects,Batrisodes profundus,a cave obligate beetle7,G1G2,S1S2,,,,Counties of occurrence:  Conecuh
2019,Insects,Batrisodes specus,a cave obligate beetle,G3G4,S2,,,,"Counties of occurrence:  Colbert, Jackson, Madison, Marshall"
2019,Insects,Batrisodes subterraneus,a cave obligate beetle,G1,S1,,,,Counties of occurrence: Marshall 
2019,Insects,Batrisodes tumoris,a beetle7,G1,S1,,,,Counties of occurrence:  Colbert
2019,Insects,Batrisodes valentinei,a cave obligate beetle,G2G4,S2,,,,"Counties of occurrence:  Jackson, Madison, Morgan"
2019,Insects,Beloneuria jamesae,Cheaha beloneurian stonefly7,G1G2,S1S2,,,,"Counties of occurrence: Calhoun, Clay, Cleburne, Talladega"
2019,Dicots,Berberis canadensis,American barberry,G3,SH,,,,"Counties of occurrence:  Jefferson4, Lee4"
2019,Dicots,Bidens cernua,nodding beggar-ticks,G5,S1,,,,"Counties of occurrence: Blount, Conecuh, Etowah, Shelby"
2019,Dicots,Bigelowia nuttallii,Nuttall's rayless goldenrod,G3G4,S3,,,,"Counties of occurrence:  Blount, Cherokee, DeKalb, Etowah, Jackson, Jefferson, Marshall"
2019,Arachnids,Bishopella jonesi,a cave obligate harvestman7,G1,S1,,,,Counties of occurrence:  Jackson
2019,Dicots,Blephilia subnuda,smooth blephilia,G1G2,S1S2,,,,"Counties of occurrence:  Jackson, Madison"
2019,Monocots,Bolboschoenus fluviatilis,river bulrush,G5,S1,,,,Counties of occurrence:  Morgan
2019,Birds,Bonasa umbellus,Ruffed Grouse,G5,S1,,GBNOS,,Counties of occurrence:  Jackson
2019,Mammals,Bos bison,American bison,G4,SX,,,EX,
2019,Birds,Botaurus lentiginosus,American Bittern,G4,S3N,,SP,,"Counties of occurrence: Baldwin,  Mobile"
2019,Ferns and Relatives,Botrychium jenmanii,Alabama grapefern,G3G4,S1,,,,"Counties of occurrence:  Baldwin, Escambia, Lee, Mobile"
2019,Dicots,Boykinia aconitifolia,brook saxifrage,G4,S1,,,,"Counties of occurrence:  Franklin, Marion"
2019,Non-Vascular Plants,Brachymenium macrocarpon,tree moss,GNRQ,S1?,,,,
2019,Dicots,Brickellia cordifolia,Flyr's brickell-bush,G2G3,S2,,,,"Counties of occurrence:  Bullock, Coffee, Conecuh, Covington, Crenshaw, Dale, Geneva, Henry, Houston, Lee, Macon, Pike, Russell"
2019,Non-Vascular Plants,Bryoxiphium norvegicum,sword moss,G5?,S1,,,,
2019,Monocots,Bulbostylis warei,Ware's hairsedge,G3G4,S1,,,,Counties of occurrence:  Baldwin
2019,Isopods,Caecidotea alabamensis,a cave obligate isopod,G3G4,S1S2,,,,
2019,Isopods,Caecidotea bicrenata bicrenata,a cave obligate isopod,G5T3T4,SNR,,,,
2019,Isopods,Caecidotea richardsonae,Tennessee valley cave isopod,G5,SNR,,,,
2019,Monocots,Calamovilfa arcuata,Cumberland sandgrass,G2G3,S1,UR,,,Counties of occurrence:  Blount
2019,Birds,Calidris canutus,Red Knot,G4,S2N,LT6,SP,P2,"Counties of occurrence:  Baldwin, Mobile"
2019,Dicots,Calliphysalis carpenteri,carpenter's ground-cherry,G3,S1,,,,"Counties of occurrence:  Autauga, Monroe, Wilcox"
2019,Dicots,Callirhoe alcaeoides,clustered poppy-mallow,G5?,S2,,,,"Counties of occurrence:  Bibb, Morgan"
2019,Dicots,Callirhoe papaver,woods poppy-mallow,G5,S1,,,,Counties of occurrence:  Washington
2019,Dicots,Callirhoe triangulata,clustered poppy-mallow,G3?,S1,,,,"Counties of occurrence:  Autauga4, Elmore, Sumter"
2019,Insects,Callophrys hesseli,Hessel's hairstreak,G3G4,SNR,,,,
2019,Insects,Callophrys irus,frosted elfin,G3,SU,,,,
2019,Monocots,Calopogon barbatus,bearded grass-pink,G4?,S1,,,,"Counties of occurrence:  Escambia, Mobile"
2019,Monocots,Calopogon multiflorus,many-flowered grass-pink,G2G3,S1,,,,"Counties of occurrence:  Baldwin, Mobile"
2019,Monocots,Calopogon oklahomensis,Oklahoma grass-pink,G3,S1,,,,Counties of occurrence:  Baldwin
2019,Crayfish and Shrimp,Cambarellus diminutus,least crayfish,G3,S2,,,P1,"Counties of occurrence:  Mobile, Washington"
2019,Crayfish and Shrimp,Cambarellus lesliei,angular dwarf crawfish,G3,S2,,,P1,"Counties of occurrence:  Baldwin4, Mobile4, Washington"
2019,Crayfish and Shrimp,Cambarellus rotatus,twisted dwarf crayfish7,G1,S1,,,,"Counties of occurrence:  Green Hale, Marengo"
2019,Crayfish and Shrimp,Cambarellus shufeldtii,Cajun dwarf crayfish,G5,S2,,,P2,Counties of occurrence:  Mobile
2019,Worms,Cambarincola sheltensis,a cave obligate worm,G1G2,S1S2,,,,
2019,Crayfish and Shrimp,Cambarus acanthura,thornytail crayfish,G4G5,S3,,,,"Counties of occurrence:  Baldwin4, Blount4, Bullock4, Calhoun, Chilton, Choctaw4, Clarke4, Colbert4, Conecuh4, Crenshaw4, DeKalb, Escambia4, Etowah4, Hale4, Jefferson4, Lauderdale4, Limestone, Marengo4, Perry4, Pike4, Russell4, Shelby, St. Clair4, Talladega4, Tuscaloosa4, Washington4"
2019,Crayfish and Shrimp,Cambarus bartonii,Appalachian brook crayfish,G5,S2,,,,"Counties of occurrence4:  Chambers, DeKalb, Lee"
2019,Crayfish and Shrimp,Cambarus cracens,slenderclaw crayfish7,G1,S1,UR,,P1,"Counties of occurrence:  DeKalb4, Marshall"
2019,Crayfish and Shrimp,Cambarus distans,boxclaw crayfish,G5,S1,,,P1,"Counties of occurrence4:  DeKalb, Jackson"
2019,Crayfish and Shrimp,Cambarus englishi,Tallapoosa crayfish,G3,S2,,,P2,"Counties of occurrence:  Clay, Cleburne, Randolph, Tallapoosa"
2019,Crayfish and Shrimp,Cambarus graysoni,twospot crayfish,G5,S3,,,,"Counties of occurrence:  Lauderdale4, Limestone4, Madison4"
2019,Crayfish and Shrimp,Cambarus halli,slackwater crayfish,G3G4,S3,,,P2,"Counties of occurrence:  Chambers, Clay, Cleburne, Lee, Randolph, Tallapoosa"
2019,Crayfish and Shrimp,Cambarus hamulatus,Prickly Cave crayfish,G3,S2,,,P2,"Counties of occurrence:  Blount4, Jackson4, Madison, Marshall"
2019,Crayfish and Shrimp,Cambarus howardi,Chattahoochee crayfish,G3Q,S2,,,P2,"Counties of occurrence:  Chambers , Lee"
2019,Crayfish and Shrimp,Cambarus jonesi,Alabama cave crayfish7,G2,S2,UR,,P2,"Counties of occurrence:  Colbert, Lauderdale, Limestone, Madison, Marshall, Morgan"
2019,Crayfish and Shrimp,Cambarus laconensis,Lacon exit cave crayfish,G1,S1,,,P1,Counties of occurrence:  Morgan
2019,Crayfish and Shrimp,Cambarus longirostris,longnose crayfish,G5Q,S2,,,P2,"Counties of occurrence:  Calhoun, Cherokee4, Cleburne4, DeKalb4, Lauderdale4, Madison4, St. Clair4"
2019,Crayfish and Shrimp,Cambarus ludovicianus,painted devil crayfish,G5,S2,,,,"Counties of occurrence:  Bibb, Dallas, Jefferson, Perry, Shelby, St. Clair"
2019,Crayfish and Shrimp,Cambarus manningi,greensaddle crayfish,G4,S2,,,P2,"Counties of occurrence:  Calhoun, Cherokee, Coosa, Etowah, St. Clair, Talladega"
2019,Crayfish and Shrimp,Cambarus miltus,rusty grave digger,G3,S2,,,,"Counties of occurrence:  Baldwin, Covington, Escambia"
2019,Crayfish and Shrimp,Cambarus parvoculus,mountain midget crayfish,G5,S1,,,P2,Counties of occurrence:  Jackson4
2019,Crayfish and Shrimp,Cambarus pecki,phantom cave crayfish7,G1G2,S1S2,,,P1,"Counties of occurrence:  Colbert, Lauderdale, Morgan"
2019,Crayfish and Shrimp,Cambarus polychromatus,paintedhand mudbug,G5,S1,,,,Counties of occurrence:  Pike
2019,Crayfish and Shrimp,Cambarus pyronotus,fireback crayfish,G2,S1,,,P1,Counties of occurrence:
2019,Crayfish and Shrimp,Cambarus rusticiformes,depression crayfish,G5,S1,,,P2,Counties of occurrence:  Jackson
2019,Crayfish and Shrimp,Cambarus scotti,Chattooga River crayfish,G3,S3,,,,"Counties of occurrence:  Calhoun, Cherokee, Cleburne, Shelby, St. Clair4, Talladega"
2019,Crayfish and Shrimp,Cambarus speleocoopi,sweet home Alabama crayfish,G1,S1,,,P2,Counties of occurrence:  Marshall
2019,Crayfish and Shrimp,Cambarus unestami,blackbarred crayfish,G2,S1,,,,"Counties of occurrence:  DeKalb, Jackson"
2019,Crayfish and Shrimp,Cambarus veitchorum,White Spring Cave crayfish7,G1,S1,,,P1,Counties of occurrence:  Limestone
2019,Freshwater Snails,Campeloma decampi,slender campeloma7,G1,S1,LE,SP,P1,"Counties of occurrence:  Limestone, Madison4"
2019,Birds,Campephilus pricipalis,Ivory-Billed Woodpecker,GH,SX,LE,SP,EX,"Counties of occurrence4:  Dallas, Hale, Lamar, Marengo, Pike, Wilcox"
2019,Fishes,Campostoma pauciradii,bluefin stoneroller,G4,S3,,,,"Counties of occurrence:  Barbour, Chambers, Houston, Lee, Randolph, Russell"
2019,Mammals,Canis rufus,red wolf,G1Q,SX,LE13,GANOS,EX,
2019,Monocots,Canna flaccida,bandana-of-the-Everglades,G4?,S1,,,,"Counties of occurrence:  Baldwin, Geneva, Houston, Mobile"
2019,Reptiles,Caretta caretta,Loggerhead Sea Turtle,G3,S1,LT,SP,P1,"Counties of occurrence:  Baldwin, Mobile"
2019,Monocots,Carex acidicola,a sedge,G2G3,S1,,,,"Counties of occurrence:  Bibb, Lee, Tuscaloosa"
2019,Monocots,Carex aggregata,glomerate sedge,G5,S1,,,,Counties of occurrence: Macon
2019,Monocots,Carex austrocaroliniana,South Carolina sedge,G4,S2?,,,,Counties of occurrence:  Jackson
2019,Monocots,Carex baltzellii,Baltzell's sedge,G3,S1,,,,"Counties of occurrence:  Dale, Geneva, Pike"
2019,Monocots,Carex barrattii,Barratt's sedge,G4,S1,,,,"Counties of occurrence:  Calhoun, Dekalb, Geneva, Winston"
2019,Monocots,Carex brysonii,Bryson's sedge7,G1,S1,UR,,,"Counties of occurrence:  Tuscaloosa, Walker, Winston"
2019,Monocots,Carex decomposita,cypress-knee sedge,G3G4,S2,,,,"Counties of occurrence:  Crenshaw, Henry, Jackson, Jefferson, Madison, Talladega"
2019,Monocots,Carex eburnea,ebony sedge,G5,S2,,,,"Counties of occurrence:  Bibb, Greene, Jackson, Sumter"
2019,Monocots,Carex exilis,coast sedge,G5,S1,,,,"Counties of occurrence:  Baldwin, Washington"
2019,Monocots,Carex fissa var. aristata,hammock sedge,G4?T4?,S1,,,,Counties of occurrence:  Barbour
