YEAR,CLASS,Scientific Name,Common Name,"Global
Rank","State
Rank","Federal
Status","State
Status","SWAP
Status",Counties of occurrence
2019,Monocots,Elodea canadensis,broad waterweed,G5,S1,,,,"Counties of occurrence:  Limestone, Marshall"
2019,Monocots,Elymus churchii,Church’s wildrye,G2G3,S1,,,,Counties of occurrence:  Madison
2019,Birds,Empidonax traillii,Willow Flycatcher,G5,S1B,SC,SP,,"Counties of occurrence:  Cherokee, Lawrence, Limestone"
2019,Dicots,Enemion biternatum,false rue-anemone,G5,S2,,,,"Counties of occurrence:  Bibb, Colbert, Conecuh, Jackson, Madison, Tuscaloosa, Winston"
2019,Fishes,Enneacanthus gloriosus,bluespotted sunfish,G5,S3,,GF,,"Counties of occurrence: Baldwin, Clarke, Covington, Mobile, Washington "
2019,Fishes,Enneacanthus obesus,banded sunfish,G5,S1,,GF,,Counties of occurrence:  Baldwin
2019,Insects,Enodia creola,Creole pearly eye,G3G4,SU,,,,Counties of occurrence:  Chilton
2019,Monocots,Epidendrum magnoliae,green-fly orchid,G4,S3,,,,"Counties of occurrence:  Baldwin, Barbour, Butler, Coffee, Conecuh, Covington, Dale, Escambia, Geneva, Henry,
Houston, Mobile"
2019,Dicots,Epilobium coloratum,purple-leaf willow-herb,G5,S1,,,,
2019,Freshwater Mussels,Epioblasma  ahlstedti,Duck River dartersnapper,G1,SH,LE39,SP,EX,"Counties of occurrence4:  Colbert, Lauderdale"
2019,Freshwater Mussels,Epioblasma brevidens,Cumberlandian combshell,G1,S1,LE-XN40,SP,P1,"Counties of occurrence:  Colbert, Franklin4, Jackson4, Lauderdale4, Morgan4"
2019,Freshwater Mussels,Epioblasma capsaeformis,oyster mussel,G1,SX,LE-XN38,SP,EXCAU,"Counties of occurrence4:  Colbert, Franklin, Jackson, Lauderdale, Limestone, Madison, Marshall, Morgan"
2019,Freshwater Mussels,Epioblasma florentina,yellow blossom,G1,SX,LE-XN41,SP,,"Counties of occurrence4:  Colbert, Lauderdale, Madison, Marshall"
2019,Freshwater Mussels,Epioblasma metastriata,upland combshell,GH42,SX,LE,SP,,"Counties of occurrence4:  Bibb, Blount, Calhoun, Cherokee, Chilton, Coosa, Cullman, Etowah, Jefferson, Shelby, St.
Clair, Talladega, Tuscaloosa, Walker"
2019,Freshwater Mussels,Epioblasma obliquata,catspaw,G1,SX,LE-XN40,SP,EX,"Counties of occurrence4:  Lauderdale, Colbert"
2019,Freshwater Mussels,Epioblasma othcaloogensis,southern acornshell,GHQ41,SX,LE,SP,EXCAU,"Counties of occurrence4: Cherokee, Etowah, Shelby, St. Clair, Talladega "
2019,Freshwater Mussels,Epioblasma penita,southern combshell,G1,S1,LE,SP,,"Counties of occurrence:  Autauga4, Dallas4, Elmore43, Greene4, Lamar, Lowndes4, Marengo4, Monroe4, Pickens4, St.
Clair4, Sumter4, Talladega4, Wilcox4"
2019,Freshwater Mussels,Epioblasma triquetra,snuffbox,G3,S1,LE,PSM,P1,"Counties of occurrence:  Colbert, Franklin4, Jackson, Lauderdale4, Limestone4, Madison, Marshall, Morgan4"
2019,Insects,Epitheca spinosa,robust baskettail,G4,S2S3,,,,"Counties of occurrence: Covington, Escambia, Tuscaloosa"
2019,Ferns and Relatives,Equisetum arvense,field horsetail,G5,S2,,,,"Counties of occurrence:  Calhoun, Greene, Hale, Jackson, Jefferson, Marshall, Morgan"
2019,Dicots,Erigeron strigosus var. dolomitica,Cahaba daisy fleabane7,G5T2?,S2?,,,,Counties of occurrence:  Bibb
2019,Fishes,Erimonax Monachus,spotfin chub,G2,SX,"LT, XN33",SP,EXCAU,"Counties of occurrence4:  Colbert, Lauderdale"
2019,Fishes,Erimystax dissimilis,streamline chub,G4,S1S2,,,P2,"Counties of occurrence:  Jackson, Marshall, Lauderdale"
2019,Fishes,Erimystax insignis,blotched chub,G4,S2,,,,"Counties of occurrence:  Jackson, Lauderdale, Madison, Marshall"
2019,Monocots,Eriocaulon aquaticum,seven-angled pipewort,G5,SH,,,,
2019,Monocots,Eriocaulon lineare,narrow pipewort,G4,S2,,,,"Counties of occurrence:  Covington, Houston"
2019,Monocots,Eriocaulon texense,Texas pipewort,G4,S2,,,,"Counties of occurrence:  Baldwin, Escambia, Mobile, Washington"
2019,Dicots,Eriogonum longifolium var. harperi ,Harper's umbrella plant,G4T2,S1,,,,"Counties of occurrence:  Colbert, Franklin, Lawrence, Madison"
2019,Monocots,Erythronium         umbilicatum         ssp. monostolum,dimpled trout lily,G5T3,S1,,,,Counties of occurrence:  Etowah
2019,Monocots,Erythronium albidum,white trout lily,G5,S1S2,,,,Counties of occurrence:  Franklin
2019,Fishes,Etheostoma bellator,warrior darter7,G2,S2,,,P2,"Counties of occurrence:  Blount, Cullman, Jefferson"
2019,Fishes,Etheostoma blennioides,greenside darter,G5,S3,,,,"Counties of occurrence:  Colbert, Franklin, Jackson, Lauderdale, Lawrence, Limestone, Madison, Marion, Morgan, Winston"
2019,Fishes,Etheostoma blennius,blenny darter,G4,S2,,,,Counties of occurrence:  Lauderdale
2019,Fishes,Etheostoma boschungi,slackwater darter,G1,S1,LT,SP,P1,"Counties of occurrence:  Lauderdale, Limestone, Madison"
2019,Fishes,Etheostoma brevirostrum,holiday darter,G2,S1,,SP,P1,"Counties of occurrence:  Calhoun, Cleburne"
2019,Fishes,Etheostoma camurum,bluebreast darter,G4,S1,,,P1,Counties of occurrence:  Limestone
2019,Fishes,Etheostoma chermocki,vermilion darter7,G1,S1,LE,SP,P1,Counties of occurrence:  Jefferson
2019,Fishes,Etheostoma chuckwachatte,lipstick darter,G3,S2,,SP,,"Counties of occurrence:  Chambers, Clay, Cleburne, Randolph, Tallapoosa"
2019,Fishes,Etheostoma cinereum,ashy darter,G2G3,SX,UR,,EX,Counties of occurrence4:  Lauderdale
2019,Fishes,Etheostoma corona,crown darter,G3,S2,,,,Counties of occurrence:  Lauderdale
2019,Fishes,Etheostoma crossopterum,fringed darter,G4,S1,,,,Counties of occurrence:  Lauderdale
2019,Fishes,Etheostoma davisoni,Choctawhatchee darter,G4,S3,,,,"Counties of occurrence: Barbour, Bullock, Butler, Coffee, Conecuh, Covington, Crenshaw, Dale, Escambia, Geneva, Henry, Houston, Pike "
2019,Fishes,Etheostoma ditrema,coldwater darter,G2,S2,,SP,P2,"Counties of occurrence:  Calhoun, Cherokee, Chilton, Coosa, Etowah, Shelby, Talladega"
2019,Fishes,Etheostoma douglasi,Tuskaloosa darter7,G3,S3,,,,"Counties of occurrence:  Blount, Cullman, Jefferson, Lawrence, Walker, Winston"
2019,Fishes,Etheostoma flabellare,fantail darter,G5,S3,,,,"Counties of occurrence:  Colbert, Franklin, Jackson, Lauderdale, Lawrence, Limestone, Madison, Morgan"
2019,Fishes,Etheostoma fusiforme,swamp darter,G5,S3,,,,"Counties of occurrence:  Autauga, Baldwin, Chambers, Clarke, Conecuh, Covington, Escambia, Geneva, Houston,
Lamar, Mobile, Monroe, Pickens, Sumter, Tuscaloosa, Washington"
2019,Fishes,Etheostoma histrio,harlequin darter,G5,S3,,,,"Counties of occurrence:  Bibb, Choctaw, Clarke, Colbert, Coosa, Covington, Dallas, Elmore, Escambia, Fayette, Franklin, Hale, Lamar, Lauderdale, Marion, Monroe, Montgomery, Pickens, Sumter, Tuscaloosa, Wilcox"
2019,Fishes,Etheostoma jessiae,blueside darter,G4,S3,,,,"Counties of occurrence:  DeKalb, Franklin, Jackson, Lauderdale, Lawrence4, Limestone, Madison"
2019,Fishes,Etheostoma kennicotti,stripetail darter,G4G5,S3,,,,"Counties of occurrence:  Colbert, Franklin, Jackson, Lauderdale, Lawrence, Limestone, Madison, Morgan"
2019,Fishes,Etheostoma lynceum,brighteye darter,G5,S1,,SP,P1,"Counties of occurrence:  Mobile, Washington"
2019,Fishes,Etheostoma neopterum,lollypop darter,G3,S1,,SP,P1,Counties of occurrence:  Lauderdale
2019,Fishes,Etheostoma nuchale,watercress darter7,G1,S1,LE,SP,P1,Counties of occurrence:  Jefferson
2019,Fishes,Etheostoma phytophilum,rush darter7,G1,S1,LE,SP,P1,"Counties of occurrence:  Etowah, Jefferson, Winston"
2019,Fishes,Etheostoma rufilineatum,redline darter,G5,S3,,,,"Counties of occurrence:  Colbert, Franklin, Jackson, Lauderdale, Limestone, Marion"
2019,Fishes,Etheostoma sp. cf . bellator “B”,Locust Fork Darter7,GNR,S1,,,P2,"Counties of occurrence:  Blount, Etowah"
2019,Fishes,Etheostoma sp. cf.  zonistium,blueface darter7,G1,S1,,,P2,"Counties of occurrence:  Franklin, Lawrence, Marion, Winston"
2019,Fishes,Etheostoma sp. cf. bellator “A”,Sipsey darter7,G2,S2,,,P2,"Counties of occurrence:  Lawrence, Winston"
2019,Fishes,Etheostoma tallapoosae,Tallapoosa darter,G4,S3,,,,"Counties of occurrence:  Chambers, Clay, Cleburne, Coosa, Lee, Randolph, Tallapoosa"
2019,Fishes,Etheostoma tennesseense,Tennessee darter,G5,S3,,,,"Counties of occurrence:  Colbert, DeKalb, Franklin, Jackson, Lauderdale, Limestone, Madison, Morgan"
2019,Fishes,Etheostoma trisella,trispot darter,G1,S1,PT,SP,P2,"Counties of occurrence:  Cherokee, Etowah, St. Clair"
2019,Fishes,Etheostoma tuscumbia,Tuscumbia darter,G2,S2,UR,SP,P2,"Counties of occurrence:  Colbert, Lauderdale, Lawrence, Limestone, Madison, Morgan"
2019,Fishes,Etheostoma wapiti,boulder darter,G1,S1,"LE, XN36",SP,P1,"Counties of occurrence:  Lauderdale4, Limestone"
2019,Fishes,Etheostoma zonale,banded darter,G5,S2,,,,"Counties of occurrence: Colbert, Jackson, Lauderdale, Lawrence, Limestone "
2019,Fishes,Etheostoma zonifer,backwater darter,G4,S3,,,,"Counties of occurrence:  Autauga, Bibb, Bullock, Choctaw, Clarke, Dallas, Elmore, Greene, Lowndes, Macon, Marengo, Monroe, Montgomery, Perry, Pickens, Russell, Sumter, Wilcox"
2019,Fishes,Etheostoma zonistium,bandfin darter,G4G5,S1,,,P2,Counties of occurrence:  Colbert
2019,Birds,Eudocimus albus,White Ibis,G5,"S2B,S3N",,SP,,"Counties of occurrence – breeding:  Baldwin, Clarke, Covington, Geneva, Houston, Mobile
Counties of occurrence – foraging or transient:  Barbour, Butler, Chilton, Cleburne, Coffee, Conecuh, Crenshaw, Dale, Escambia, Henry, Lowndes, Marshall, Monroe, Montgomery, Russell, Shelby, Sumter, Wilcox, Washington"
2019,Insects,Euhadenoecus putaneus,a cave cricket,GNR,S1,,,,"Counties of occurrence:  DeKalb, Jackson"
2019,Dicots,Euphorbia discoidalis,euphorbia,G3?Q,S2?,,,,Counties of occurrence:  Baldwin
2019,Dicots,Euphorbia inundata,Florida pine spurge,G4G5,S1,,,,Counties of occurrence: Baldwin4
2019,Insects,Euphyes arpa,palmetto skipper,G3G4,SNR,,,,
2019,Insects,Euphyes dukesi dukesi,Dukes' skipper,G3T3,SNR,,,,
2019,Insects,Euphyes pilatka,palatka skipper,G3G4,S3S4,,,,
2019,Dicots,Eurybia chapmanii,Chapman aster,G2G3,SH,,,,"Counties of occurrence:  Geneva, Houston, Mobile"
2019,Dicots,Eurybia eryngiifolia,coyote-thistle aster,G3G4,S1,,,,"Counties of occurrence:  Covington, Geneva"
2019,Dicots,Eurybia spectabilis,showy aster,G5,S2,,,,"Counties of occurrence:  Covington, DeKalb"
2019,Dicots,Eurybia surculosus,creeping aster,G4G5,S1,,,,Counties of occurrence:  Jackson
2019,Monocots,Eustachys floridana,two-spike finger grass,G2?,S1,,,,Counties of occurrence:  Geneva
2019,Dicots,Evolvulus sericeus var. sericeus,creeping morning-glory,G5T3T5,S1,,,,Counties of occurrence:  Dallas
2019,Birds,Falco peregrinus,Peregrine Falcon,G4,"SHB,S3N",,SP,,"Counties of occurrence:3  Colbert, Lauderdale, Lawrence, Limestone, Madison, Marshall"
2019,Birds,Falco sparverius,American Kestrel,G5,"S3B,S5N",,SP,P22,"Counties of occurrence:  Bibb, Blount, Butler, Cherokee, Chilton, Choctaw, Clarke, Clay, Colbert, Coosa, Covington, Cullman, DeKalb, Etowah, Franklin, Hale, Houston, Jackson, Jefferson, Lauderdale, Lawrence, Lee, Limestone, Madison, Marengo, Marion, Marshall, Monroe, Montgomery, Morgan, Shelby, St. Clair, Tuscaloosa, Walker, Washington, Wilcox, Winston"
2019,Reptiles,Farancia erytrogramma,Rainbow Snake,G4,S3,,SP,P1,"Counties of occurrence:  Baldwin, Chilton, Covington, Dale, Escambia, Henry, Mobile, Shelby, Tuscaloosa"
2019,Insects,Feniseca tarquinius,harvester,G4,SU,,,,
2019,Freshwater Snails,Ferrissia mcneili,hood ancylid7,G2G3,S2,,,,Counties of occurrence:  Mobile
2019,Monocots,Fimbristylis brevivaginata,glade fimbristylis,G2,S1,,,,Counties of occurrence:  DeKalb
2019,Monocots,Fimbristylis perpusilla,Harper’s fimbry,G2,S1,,,,Counties of occurrence:  Covington
2019,Non-Vascular Plants,Fissidens hyalinus,filmy fissidens,GNR,S1,,,,
2019,Non-Vascular Plants,Fissidens kegelianus,fan moss,GNRQ,S1?,,,,
2019,Non-Vascular Plants,Fissidens neonii,moss,G2?,S1?,,,,
2019,"Diplurans, Springtails and Proturans",Folsomia candida,a springtail,GNR,S1,,,,Counties of occurrence:  Colbert
2019,"Diplurans, Springtails and Proturans",Folsomia sp. 1,a springtail,GNR,S1,,,,"Counties of occurrence:  Blount, Jackson"
2019,Freshwater Snails,Fontigens nickliniana,watercress snail,G5,S1,,,P1,"Counties of occurrence:  Blount, Calhoun, Tuscaloosa"
2019,Non-Vascular Plants,Fontinalis welchiana,difficult moss,GU,S1?,,,,Counties of occurrence:  DeKalb
2019,Dicots,Fothergilla gardenii,dwarf witch-alder,G3G4,S1,,,,"Counties of occurrence:  Baldwin, Escambia4, Geneva"
2019,Dicots,Fothergilla major,mountain witch-alder,G3,S2,,,,"Counties of occurrence:  Blount, Cherokee, Cullman, DeKalb, Franklin, Jackson, Marshall, St. Clair"
2019,Non-Vascular Plants,Frullania riparia,liverwort,G4G5,S1?,,,,Counties of occurrence:  Jackson
2019,Fishes,Fundulus bifax,stippled studfish,G2G3,S2,,,,"Counties of occurrence:  Chambers, Coosa, Elmore, Randolph, Tallapoosa"
2019,Fishes,Fundulus blaire,western starhead topminnow,G4,S3,,,,"Counties of occurrence:  Autauga, Baldwin, Bibb, Choctaw, Clarke, Escambia, Mobile, Monroe, Perry, Wilcox"
2019,Fishes,Fundulus catenatus,northern studfish,G5,S3S4,,,,"Counties of occurrence:  Colbert, Franklin, Jackson, Lauderdale, Limestone"
2019,Fishes,Fundulus chrysotus,golden topminnow,G5,S3,,,,"Counties of occurrence:  Baldwin, Mobile"
2019,Fishes,Fundulus cingulatus,banded topminnow,G4,S2,,,,"Counties of occurrence:  Baldwin, Covington, Escambia, Mobile"
2019,Fishes,Fundulus confluentus,marsh killifish,G5,S2,,,,Counties of occurrence:  Baldwin
2019,Fishes,Fundulus dispar,starhead topminnow,G4,S2,,,,"Counties of occurrence:  Choctaw, Clarke, Greene, Mobile, Sumter, Tuscaloosa"
2019,Fishes,Fundulus escambiae,russetfin topminnow,G4,S3,,,,"Counties of occurrence:  Baldwin, Barbour, Bullock, Covington, Dale, Escambia, Geneva, Houston"
2019,Fishes,Fundulus jenkinsi,saltmarsh topminnow,G2,S1,SC35,,,"Counties of occurrence:  Baldwin, Mobile"
2019,Fishes,Fundulus pulvereus,Bayou killifish,G5,S2,,,,"Counties of occurrence:  Baldwin, Mobile"
2019,Freshwater Mussels,Fusconaia burkei,tapered pigtoe,G2G3,S2,LT,SP,P2,"Counties of occurrence:  Barbour, Coffee, Dale, Geneva, Henry, Pike"
2019,Freshwater Mussels,Fusconaia cor,shiny pigtoe,G1,S1,LE-XN40,SP,P1,"Counties of occurrence:  Colbert4, Jackson, Lauderdale4, Madison, Marshall"
2019,Freshwater Mussels,Fusconaia cuneolus,finerayed pigtoe,G1,S1,LE-XN40,SP,P1,"Counties of occurrence:  Colbert4, Jackson, Lauderdale4, Limestone4, Madison, Marshall, Morgan4"
2019,Freshwater Mussels,Fusconaia escambia,narrow pigtoe,G2,S2,LT,SP,P2,"Counties of occurrence:  Butler, Conecuh, Covington, Crenshaw, Escambia, Pike"
2019,Freshwater Mussels,Fusconaia subrotunda,longsolid,G3,S1,UR,PSM,P1,"Counties of occurrence:  Colbert, Jackson, Lauderdale, Limestone4, Madison, Marshall, Morgan4"
2019,Dicots,Galactia floridana,Florida milk pea,G3G4,S1,,,,Counties of occurrence: Mobile
2019,Dicots,Galium lanceolatum,Torrey's wild licorice,G5,S1,,,,
2019,Terrestrial Snails,Gastrocopta abbreviata,plains snaggletooth,G4,S1,,,,
2019,Terrestrial Snails,Gastrocopta clappi,bluegrass snaggletooth,G4G5,SNR,,,,
2019,Terrestrial Snails,Gastrocopta pellucida,slim snaggletooth,G5,S1,,,,
2019,Terrestrial Snails,Gastrocopta procera,wing snaggletooth,G5,SNR,,,,
2019,Terrestrial Snails,Gastrocopta riparia,Gulf Coast snaggletooth,G4G5,SNR,,,,
2019,Terrestrial Snails,Gastrocopta rupicola,tapered snaggletooth,G4,SNR,,,,
2019,Birds,Gelochelidon nilotica,Gull-Billed Tern,G5,"S2B,S4N",,SP,P2,"Counties of occurrence:  Baldwin, Mobile"
2019,Mammals,Geomys pinetis,southeastern pocket gopher,G5,S3,,SP,P2,"Counties of occurrence:  Autauga, Baldwin, Barbour, Bullock, Clarke3, Coffee, Conecuh3, Covington, Crenshaw, Dale, Dallas3, Escambia, Geneva, Henry3, Houston, Macon,Monroe3, Montgomery, Russell, Tuscaloosa3"
2019,Dicots,Geum vernum,spring avens,G5,S1,,,,"Counties of occurrence:  Lawrence, Morgan"
2019,Dicots,Geum virginianum,pale avens,G5,S2,,,,"Counties of occurrence:  Jackson, Madison"
2019,Freshwater Mussels,Glebula rotundata,round pearlshell,G4G5,S2,,PSM,,"Counties of occurrence:  Baldwin, Choctaw, Clarke, Escambia, Mobile, Washington"
2019,Terrestrial Snails,Glyphyalinia cumberlandiana,hill glyph,G4,SNR,,,,
2019,Terrestrial Snails,Glyphyalinia latebricola,stone glyph,G1G2,SNR,,,,Counties of occurrence:  Jackson
2019,Terrestrial Snails,Glyphyalinia pecki,blind glyph7,G1G2,S1S2,,,,Counties of occurrence:  Jefferson
2019,Terrestrial Snails,Glyphyalinia specus,hollow glyph,G4,SNR,,,,Counties of occurrence:  Jackson
2019,Insects,Gomphus consanguis,Cherokee clubtail,G3,S1S2,UR,,,"Counties of occurrence: Blount, St. Clair"
2019,Insects,Gomphus crassus,handsome clubtail,G3G4,S3,,,,"Counties of occurrence: Jackson, Lauderdale, Madison"
2019,Insects,Gomphus geminatus,twin-striped clubtail,G3G4,S2,,,,"Counties of occurrence: Covington, Escambia"
2019,Insects,Gomphus hodgesi,Hodges' clubtail,G3,S3?,,,,
2019,Insects,Gomphus hybridus,cocoa clubtail,G4,S3S4,,,,
2019,Insects,Gomphus modestus,Gulf Coast clubtail,G3G4,S3?,,,,
2019,Insects,Gomphus quadricolor,rapids clubtail,G3G4,S1,,,,
2019,Insects,Gomphus septima,Septima's clubtail,G2,S1S2,UR,,,"Counties of occurrence:  Bibb, Tuscaloosa4"
2019,Insects,Gomphus viridifrons,green-faced clubtail,G3G4,S3?,,,,
2019,Reptiles,Gopherus polyphemus,Gopher Tortoise,G3,S3,"LT, C28",SP,P2,"Counties of occurrence:  Baldwin, Barbour, Bullock, Butler, Choctaw, Clarke, Coffee, Conecuh, Covington, Crenshaw, Dale, Escambia, Geneva, Henry, Houston, Mobile, Monroe, Pike, Russell, Washington"
2019,Dicots,Gordonia lasianthus,loblolly bay,G5,S1,,,,"Counties of occurrence:  Baldwin, Houston, Mobile, Monroe"
2019,Reptiles,Graptemys barbouri,Barbour’s Map Turtle,G2,S2,,SP,P2,"Counties of occurrence:  Barbour, Coffee, Dale, Geneva, Houston, Russell"
2019,Reptiles,Graptemys ernsti,Escambia Map Turtle,G2,S2,UR,SP,P2,"Counties of occurrence:  Coffee, Covington, Escambia, Geneva"
2019,Reptiles,Graptemys geographica,Northern Map Turtle,G5,S3,,,,"Counties of occurrence:  Bibb, Blount, Colbert, Coosa, Cullman, Jefferson, Lauderdale, Lawrence, Limestone, Madison, Marshall, Morgan, Shelby"
2019,Reptiles,Graptemys ouachitensis,Southern Map Turtle,G5,S3,,,,"Counties of occurrence:  Colbert, Jackson, Lauderdale, Lawrence, Madison, Marshall, Morgan"
2019,Reptiles,Graptemys pulchra,Alabama Map Turtle,G4,S3,UR,SP,,"Counties of occurrence:  Autauga, Baldwin, Bibb, Cherokee, Chilton, Choctaw, Clarke, Coosa, Dallas, Elmore, Etowah, Greene, Hale, Jefferson, Lowndes, Marengo, Mobile, Monroe, Montgomery, Perry, Shelby, Sumter, Talladega, Tallapoosa, Washington, Wilcox"
2019,Dicots,Gratiola pusilla ,granite pool sprite,G2,S1,LT,,,"Counties of occurrence:  Chambers, Randolph, Tallapoosa"
2019,Birds,Grus americana,Whooping Crane,G1,S1N,"LT,XN",SP,,"Counties of occurrence:  Limestone, Madison, Morgan"
2019,Birds,Grus canadensis pulla,Mississippi Sandhill Crane,G5T1,SH,LE,SP,,Counties of occurrence:  Baldwin
2019,Amphibians,Gyrinophilus palleucus palleucus,Pale Salamander,G2G3T2,S2,UR,SP,P2,"Counties of occurrence:  Colbert, DeKalb, Jackson, Limestone, Madison, Marshall"
2019,Monocots,Habenaria quinqueseta var. quinqueseta,Michaux's orchid,G4G5T4?,S1,,,,Counties of occurrence:  Baldwin
2019,Birds,Haematopus palliatus,American Oystercatcher,G5,S1,,SP,P1,Counties of occurrence:  Mobile
2019,Dicots,Hamamelis ovalis,Mississippi witch hazel,G1,S1,,,,"Counties of occurrence:  Clarke, Covington, Monroe, Wilcox"
2019,Freshwater Mussels,Hamiota altilis44,finelined pocketbook,G2G3,S2,LT,SP,P2,"Counties of occurrence:  Bibb, Blount, Calhoun, Cherokee, Chilton, Clay, Cleburne, Coosa, Dallas, Elmore, Etowah, Jefferson, Lee, Macon, Monroe, Perry, Shelby, St. Clair, Talladega, Wilcox"
2019,Freshwater Mussels,Hamiota australis41,southern sandshell,G2G3,S2,LT,SP,P2,"Counties of occurrence:  Barbour, Coffee, Conecuh, Covington, Crenshaw, Dale, Escambia, Geneva, Henry, Houston, Pike"
2019,Freshwater Mussels,Hamiota perovalis41,orangenacre mucket,G2,S2,LT,SP,P2,"Counties of occurrence:  Bibb, Blount, Choctaw, Dallas, Fayette, Greene, Jefferson, Lamar, Lawrence, Marion,
Monroe, Pickens, Shelby, Sumter, Tuscaloosa, Winston"
2019,Freshwater Mussels,Hamiota subangulata41,shinyrayed pocketbook,G2,S1,LE,SP,P1,"Counties of occurrence:  Barbour4, Houston, Lee, Russell"
2019,Dicots,Harperella nodosa,harperella,G2,S1,LE,,,"Counties of occurrence:  Cherokee, Cullman4, DeKalb, Tuscaloosa4"
2019,Dicots,Hedeoma drummondii,Drummond's pennyroyal,G5,S2,,,,"Counties of occurrence:  Greene, Lowndes, Marengo, Sumter"
2019,Dicots,Helenium brevifolium,little leaf sneezeweed,G4,S1,,,,"Counties of occurrence:  Baldwin, Escambia, Geneva"
2019,Dicots,Helenium vernale,spring sneezeweed,G4?,S2,,,,"Counties of occurrence:  Baldwin, Escambia, Geneva"
2019,Dicots,Helianthemum arenicola,coastal-sand frostweed,G3,S1,,,,"Counties of occurrence:  Baldwin, Mobile"
2019,Dicots,Helianthus eggertii,Eggert's  sunflower,G3,S2,,,,"Counties of occurrence:  Bibb, Blount, Butler, Calhoun, DeKalb, Franklin, Madison"
2019,Dicots,Helianthus glaucophyllus,white-leaved sunflower,G3G4,SH,,,,"Counties of occurrence:  Coosa, Jackson"
2019,Dicots,Helianthus longifolius,longleaf sunflower,G3,S1S2,,,,"Counties of occurrence:  Cherokee, DeKalb, Jackson"
2019,Dicots,Helianthus porteri,confederate daisy,G4,S2,,,,"Counties of occurrence:  Chambers, Lee, Randolph"
2019,Dicots,Helianthus smithii,Smith’s sunflower,G2Q,S2,,,,"Counties of occurrence:  Bibb, Blount, Calhoun, Cherokee, Clay, Cleburne, Jackson4, Lee4, Marion4, Randolph4, Talladega"
2019,Dicots,Helianthus verticillatus,whorled sunflower,G1,S1,LE,,,Counties of occurrence:  Cherokee
2019,Terrestrial Snails,Helicodiscus aldrichianus,burrowing coil,G3,SNR,,,,
2019,Terrestrial Snails,Helicodiscus barri,raccoon coil,G3G4,SNR,,,,"Counties of occurrence:  Colbert, Lauderdale, Madison"
2019,Terrestrial Snails,Helicodiscus fimbriatus,fringed coil,G4,SNR,,,,"Counties of occurrence:  Jackson, Madison"
2019,Terrestrial Snails,Helicodiscus hadenoecus,cricket coil,G3,SNR,,,,Counties of occurrence:  Madison
2019,Terrestrial Snails,Helicodiscus singleyanus,smooth coil,G5,SX,,,,
2019,Insects,Hemileuca maia maia,Coastal Barrens buckmoth,G5T5,SNR,,,,
2019,Freshwater Mussels,Hemistena lata,cracking pearlymussel,G1,S1,LE-XN39,SP,P1,"Counties of occurrence:  Colbert4, Lauderdale4, Limestone"
2019,Fishes,Hemitremia flammea,flame chub,G3,S3,,,,"Counties of occurrence:  Blount, Calhoun, Colbert, DeKalb, Lauderdale, Lawrence, Limestone, Madison, Morgan, Talladega"
2019,Insects,Hesperia meskei,Meske's skipper,G2G4,S3?,,,,
2019,Arachnids,Hesperonemastoma pallidimaculosa,a cave obligate harvestman7,G3,S1?,,,,"Counties of occurrence: Marshall, Morgan "
2019,Fishes,Heterandria formosa,least killifish,G5,S3,,,,"Counties of occurrence:  Baldwin, Clarke, Geneva, Houston, Mobile, Washington, Wilcox"
2019,Reptiles,Heterodon simus,Southern Hog-nosed Snake,G2,SH,UR,SP,P1,"Counties of occurrence20:  Autauga, Baldwin, Calhoun, Choctaw, Clarke, Covington, Dale, Escambia, Shelby"
2019,Insects,Heterosternuta folkertsi,Folkerts' hydroporus diving beetle,G1G3,S1S2,,,,
2019,Dicots,Heuchera longiflora,long-flower alumroot,G4,S1,,,,"Counties of occurrence:  Clay, Talladega"
2019,Dicots,Hexastylis shuttleworthii var. harperi,Harper's wild ginger,G4T3,S2,,,,"Counties of occurrence:  Autauga, Bibb, Chilton, Perry, Russell"
2019,Dicots,Hexastylis speciosa,Harper's heartleaf7,G2,S2,UR,,,"Counties of occurrence:  Autauga Chilton, Elmore"
2019,Dicots,Hibiscus coccineus,brilliant hibiscus,G4?,S1,,,,"Counties of occurrence:  Mobile, Wilcox"
2019,Fishes,Hiodon alosoides,goldeye,G5,SX,,,EX,"Counties of occurrence4:  Lawrence, Limestone, Madison, Morgan"
2019,Fishes,Hiodon tergisus,mooneye,G5,S3S4,,,,"Counties of occurrence:  Baldwin, Bibb, Chilton, Choctaw, Clarke, Colbert, Coosa, Dallas, Elmore, Greene, Hale, Lamar, Lauderdale, Lawrence, Limestone, Lowndes, Macon, Madison, Marengo, Marshall,
Mobile, Monroe, Montgomery, Morgan, Perry, Pickens, Shelby, Sumter, Talladega, Tallapoosa, Washington, Wilcox"
2019,Crayfish and Shrimp,Hobbseus prominens,Prominence Riverlet crayfish,G4G5,S3,,,P2,"Counties of occurrence4:  Chilton, Choctaw, Dallas, Greene, Hale, Marengo, Perry, Sumter"
2019,Non-Vascular Plants,Homaliadelphus sharpii,liverwort,GNR,S1,,,,
2019,Insects,Homoeoneuria cahabensis,Cahaba sand-filtering mayfly,G2G3,S1S2,,,,
2019,Dicots,Hottonia inflata ,featherfoil,G4,S2,,,,"Counties of occurrence:  Dallas, Greene, Jefferson, Macon, Madison, Montgomery, Perry"
2019,Ferns and Relatives,Huperzia lucidula,shining clubmoss,G5,S2,,,,"Counties of occurrence:  Franklin, Lawrence, Marion, Winston"
2019,Ferns and Relatives,Huperzia porophila,rock clubmoss,G4,S1,,,,"Counties of occurrence:  Franklin, Lawrence, Marion, Walker, Winston"
2019,Fishes,Hybognathus hayi,cypress minnow,G5,S3,,,,"Counties of occurrence:  Dallas, Perry"
2019,Fishes,Hybognathus nuchalis,Mississippi silvery minnow,G5,S4,,,,"Counties of occurrence:  Autauga, Baldwin, Bibb, Dallas, Elmore, Fayette, Franklin, Greene, Marion, Perry, Pickens, Sumter, Tuscaloosa, Washington, Wilcox"
2019,Fishes,Hybopsis amblops,bigeye chub,G5,S3,,,,"Counties of occurrence:  Colbert, Franklin, Jackson, Lauderdale, Lawrence, Limestone, Madison, Marion, Marshall"
2019,Fishes,Hybopsis lineapunctata,lined chub,G3G4,S3,,,,"Counties of occurrence: Calhoun, Chambers, Clay, Cleburne, Coosa, Elmore, Etowah, Lee, Macon, Randolph, Talladega, Tallapoosa"
2019,Dicots,Hydrastis canadensis,golden seal,G3G4,S2,,,,"Counties of occurrence:  Blount, Franklin, Jackson, Lawrence, Marshall"
2019,Dicots,Hydrophyllum appendiculatum,appendage waterleaf,G5,S2?,,,,Counties of occurrence:  Jackson
2019,Birds,Hydroprogne caspia,Caspian Tern,G5,"S2B,S4N",,SP,,"Counties of occurrence:  Baldwin, Mobile"
2019,Amphibians,Hyla andersonii,Pine Barrens Treefrog,G4,S2,,SP,P1,"Counties of occurrence:  Covington, Escambia, Geneva"
